key,title,authors,year,journal,abstract,doi
10.1145/3571206,"Executing Microservice Applications on Serverless, Correctly","Kallas, Konstantinos; Zhang, Haoran; Alur, Rajeev; Angel, Sebastian; Liu, Vincent",2023,Proc. ACM Program. Lang.,"While serverless platforms substantially simplify the provisioning, configuration, and management of cloud applications, implementing correct services on top of these platforms can present significant challenges to programmers. For example, serverless infrastructures introduce a host of failure modes that are not present in traditional deployments. Individual serverless instances can fail while others continue to make progress, correct but slow instances can be killed by the cloud provider as part of resource management, and providers will often respond to such failures by re-executing requests. For functions with side-effects, these scenarios can create behaviors that are not observable in serverful deployments. In this paper, we propose mu2sls, a framework for implementing microservice applications on serverless using standard Python code with two extra primitives: transactions and asynchronous calls. Our framework orchestrates user-written services to address several challenges, such as failures and re-executions, and provides formal guarantees that the generated serverless implementations are correct. To that end, we present a novel service specification abstraction and formalization of serverless implementations that facilitate reasoning about the correctness of a given application’s serverless implementation. This formalization forms the basis of the mu2sls prototype, which we then use to develop a few real-world microservice applications and show that the performance of the generated serverless implementations achieves significant scalability (3-5\texttimes{} the throughput of a sequential implementation) while providing correctness guarantees in the context of faults, re-execution, and concurrency.",10.1145/3571206
10.1145/3572901,Could Tierless Languages Reduce IoT Development Grief?,"Lubbers, Mart; Koopman, Pieter; Ramsingh, Adrian; Singer, Jeremy; Trinder, Phil",2023,ACM Trans. Internet Things,"Internet of Things (IoT) software is notoriously complex, conventionally comprising multiple tiers. Traditionally an IoT developer must use multiple programming languages and ensure that the components interoperate correctly. A novel alternative is to use a single tierless language with a compiler that generates the code for each component and ensures their correct interoperation.We report a systematic comparative evaluation of two tierless language technologies for IoT stacks: one for resource-rich sensor nodes (Clean with iTask) and one for resource-constrained sensor nodes (Clean with iTask and mTask). The evaluation is based on four implementations of a typical smart campus application: two tierless and two Python-based tiered.(1) We show that tierless languages have the potential to significantly reduce the development effort for IoT systems, requiring 70\% less code than the tiered implementations. Careful analysis attributes this code reduction to reduced interoperation (e.g., two embedded domain-specific languages and one paradigm versus seven languages and two paradigms), automatically generated distributed communication, and powerful IoT programming abstractions. (2) We show that tierless languages have the potential to significantly improve the reliability of IoT systems, describing how Clean iTask/mTask maintains type safety, provides higher-order failure management, and simplifies maintainability. (3) We report the first comparison of a tierless IoT codebase for resource-rich sensor nodes with one for resource-constrained sensor nodes. The comparison shows that they have similar code size (within 7\%), and functional structure. (4) We present the first comparison of two tierless IoT languages, one for resource-rich sensor nodes and the other for resource-constrained sensor nodes.",10.1145/3572901
10.1145/3573009,Performance Interference of Virtual Machines: A Survey,"Lin, Weiwei; Xiong, Chennian; Wu, Wentai; Shi, Fang; Li, Keqin; Xu, Minxian",2023,ACM Comput. Surv.,"The rapid development of cloud computing with virtualization technology has benefited both academia and industry. For any cloud data center at scale, one of the primary challenges is how to effectively orchestrate a large number of virtual machines (VMs) in a performance-aware and cost-effective manner. A key problem here is that the performance interference between VMs can significantly undermine the efficiency of cloud data centers, leading to performance degradation and additional operation cost. To address this issue, extensive studies have been conducted to investigate the problem from different aspects. In this survey, we make a comprehensive investigation into the causes of VM interference and provide an in-depth review of existing research and solutions in the literature. We first categorize existing studies on interference models according to their modeling objectives, metrics used, and modeling methods. Then we revisit interference-aware strategies for scheduling optimization as well as co-optimization-based approaches. Finally, the survey identifies open challenges with respect to VM interference in data centers and discusses possible research directions to provide insights for future research in the area.",10.1145/3573009
10.1145/3573125,VioLinn: Proximity-aware Edge Placementwith Dynamic and Elastic Resource Provisioning,"Tocz\'{e}, Klervie; Fahs, Ali J.; Pierre, Guillaume; Nadjm-Tehrani, Simin",2023,ACM Trans. Internet Things,"Deciding where to handle services and tasks, as well as provisioning an adequate amount of computing resources for this handling, is a main challenge of edge computing systems. Moreover, latency-sensitive services constrain the type and location of edge devices that can provide the needed resources. When available resources are scarce there is a possibility that some resource allocation requests are denied.In this work, we propose the VioLinn system to tackle the joint problems of task placement, service placement, and edge device provisioning. Dealing with latency-sensitive services is achieved through proximity-aware algorithms that ensure the tasks are handled close to the end-user. Moreover, the concept of spare edge device is introduced to handle sudden load variations in time and space without having to continuously overprovision. Several spare device selection algorithms are proposed with different cost/performance tradeoffs.Evaluations are performed both in a Kubernetes-based testbed and using simulations and show the benefit of using spare devices for handling localized load spikes with higher quality of service (QoS) and lower computing resource usage. The study of the different algorithms shows that it is possible to achieve this increase in QoS with different tradeoffs against cost and performance.",10.1145/3573125
10.1145/3573206,A Flexible and Modular Architecture for Edge Digital Twin: Implementation and Evaluation,"Picone, Marco; Mamei, Marco; Zambonelli, Franco",2023,ACM Trans. Internet Things,"IoT systems based on Digital Twins (DTs) — virtual copies of physical objects and systems — can be very effective to enable data-driven services and promote better control and decisions, in particular by exploiting distributed approaches where cloud and edge computing cooperate effectively. In this context, digital twins deployed on the edge represents a new strategic element to design a new wave of distributed cyber-physical applications. Existing approaches are generally focused on fragmented and domain-specific monolithic solutions and are mainly associated to model-driven, simulative or descriptive visions. The idea of extending the DTs role to support last-mile digitalization and interoperability through a set of general purpose and well-defined properties and capabilities is still underinvestigated. In this paper, we present the novel Edge Digital Twins (EDT) architectural model and its implementation, enabling the lightweight replication of physical devices providing an efficient digital abstraction layer to support the autonomous and standard collaboration of things and services. We model the core capabilities with respect to the recent definition of the state of the art, present the software architecture and a prototype implementation. Extensive experimental analysis shows the obtained performance in multiple IoT application contexts and compares them with that of state-of-the-art approaches.",10.1145/3573206
10.1145/3574323,Principled Schedulability Analysis for Distributed Storage Systems Using Thread Architecture Models,"Yang, Suli; Liu, Jing; Arpaci-Dusseau, Andrea; Arpaci-Dusseau, Remzi",2023,ACM Trans. Storage,"In this article, we present an approach to systematically examine the schedulability of distributed storage systems, identify their scheduling problems, and enable effective scheduling in these systems. We use Thread Architecture Models (TAMs) to describe the behavior and interactions of different threads in a system, and show both how to construct TAMs for existing systems and utilize TAMs to identify critical scheduling problems. We specify three schedulability conditions that a schedulable TAM should satisfy: completeness, local enforceability, and independence; meeting these conditions enables a system to easily support different scheduling policies. We identify five common problems that prevent a system from satisfying the schedulability conditions, and show that these problems arise in existing systems such as HBase, Cassandra, MongoDB, and Riak, making it difficult or impossible to realize various scheduling disciplines. We demonstrate how to address these schedulability problems using both direct and indirect solutions, with different trade-offs. To show how to apply our approach to enable scheduling in realistic systems, we develop Tamed-HBase and Muzzled-HBase, sets of modifications to HBase that can realize the desired scheduling disciplines, including fairness and priority scheduling, even when presented with challenging workloads.",10.1145/3574323
10.1145/3579353,"Macroprogramming: Concepts, State of the Art, and Opportunities of Macroscopic Behaviour Modelling","Casadei, Roberto",2023,ACM Comput. Surv.,"Macroprogramming refers to the theory and practice of expressing the macro(scopic) behaviour of a collective system using a single program. Macroprogramming approaches are motivated by the need of effectively capturing global/system-level aspects and the collective behaviour of multiple computational components, while abstracting over low-level details. Previously, this programming style had been primarily adopted to describe the data-processing logic in sensor networks; recently, research forums on spatial computing, collective systems, and the Internet of Things have provided renewed interest in macro approaches. However, related contributions are still fragmented and lack conceptual consistency. Therefore, to foster principled research, an integrated view of the field is provided, together with opportunities and challenges.",10.1145/3579353
10.1145/3579643,Rise of the Planet of Serverless Computing: A Systematic Review,"Wen, Jinfeng; Chen, Zhenpeng; Jin, Xin; Liu, Xuanzhe",2023,ACM Trans. Softw. Eng. Methodol.,"Serverless computing is an emerging cloud computing paradigm, being adopted to develop a wide range of software applications. It allows developers to focus on the application logic in the granularity of function, thereby freeing developers from tedious and error-prone infrastructure management. Meanwhile, its unique characteristic poses new challenges to the development and deployment of serverless-based applications. To tackle these challenges, enormous research efforts have been devoted. This article provides a comprehensive literature review to characterize the current research state of serverless computing. Specifically, this article covers 164 articles on 17 research directions of serverless computing, including performance optimization, programming framework, application migration, multi-cloud development, testing and debugging, and so on. It also derives research trends, focus, and commonly-used platforms for serverless computing, as well as promising research opportunities.",10.1145/3579643
10.1145/3581759,A Survey on Edge Intelligence and Lightweight Machine Learning Support for Future Applications and Services,"Hoffpauir, Kyle; Simmons, Jacob; Schmidt, Nikolas; Pittala, Rachitha; Briggs, Isaac; Makani, Shanmukha; Jararweh, Yaser",2023,J. Data and Information Quality,"As the number of devices connected to the Internet has grown larger, so too has the intensity of the tasks that these devices need to perform. Modern networks are more frequently working to perform computationally intensive tasks on low-power devices and low-end hardware. Current architectures and platforms tend towards centralized and resource-rich cloud computing approaches to address these deficits. However, edge computing presents a much more viable and flexible alternative. Edge computing refers to a distributed and decentralized network architecture in which demanding tasks such as image recognition, smart city services, and high-intensity data processing tasks can be distributed over a number of integrated network devices. In this article, we provide a comprehensive survey for emerging edge intelligence applications, lightweight machine learning algorithms, and their support for future applications and services. We start by analyzing the rise of cloud computing, discuss its weak points, and identify situations in which edge computing provides advantages over traditional cloud computing architectures. We then divulge details of the survey: the first section identifies opportunities and domains for edge computing growth, the second identifies algorithms and approaches that can be used to enhance edge intelligence implementations, and the third specifically analyzes situations in which edge intelligence can be enhanced using any of the aforementioned algorithms or approaches. In this third section, lightweight machine learning approaches are detailed. A more in-depth analysis and discussion of future developments follows. The primary discourse of this article is in service of an effort to ensure that appropriate approaches are applied adequately to artificial intelligence implementations in edge systems, mainly, the lightweight machine learning approaches.",10.1145/3581759
10.1145/3582081,Situational Factor Determinants of the Allocation of Decision Rights to Edge Computers,"Chua, Cecil Eng Huang; Niederman, Fred",2023,ACM Trans. Manage. Inf. Syst.,"Internet of Things (IoT) designers frequently must determine whether action-oriented decisions should be made by edge computers or whether they should be made only by central servers combining input from all edge computers. An important example of this design problem occurs in fire protection IoT, where individual edge computers attached to sensors might be empowered to make decisions (have decision rights) about how to manage the fire. Alternatively, decision rights could be held exclusively by a central server isolated from the fire, because the designer is concerned damage to edge computers could cause them to act unreliably. This research models this allocation of decision rights to identify the relative influence of various decision factors. We first model the allocation of decision rights under the following assumptions: (1) The central server cannot make an error the edge computer cannot make; (2) the central server cannot update the edge computer with its information in a timely manner; and (3) the central server cannot reverse an action initiated by the edge computer to explore the factors impacting decision rights conferral. We then relax each of these three assumptions. We show how relaxing each assumption radically changes the factors impacting decision rights conferral. We also show that allowing the central server to update information on the edge computer or reverse the edge computer's decision making can result in overall lower system performance. We then perform a series of numerical experiments to understand how changing various parameters affect the problem. We show for the general real-world scenario, the key factor influencing the decision is the ability of the edge computer to detect false alarms. We also show magnitude of loss and ratio of real to false incidents have a linear and logarithmic relationship to the reliability of the edge computer.",10.1145/3582081
10.1145/3582695,Realizing Strong Determinism Contract on Log-Structured Merge Key-Value Stores,"Kwon, Miryeong; Lee, Seungjun; Choi, Hyunkyu; Hwang, Jooyoung; Jung, Myoungsoo",2023,ACM Trans. Storage,"We propose Vigil-KV, a hardware and software co-designed framework that eliminates long-tail latency almost perfectly by introducing strong latency determinism. To make Get latency deterministic, Vigil-KV first enables a predictable latency mode (PLM) interface on a real datacenter-scale NVMe SSD, having knowledge about the nature of the underlying flash technologies. Vigil-KV at the system-level then hides the non-deterministic time window (associated with SSD’s internal tasks and/or write services) by internally scheduling the different device states of PLM across multiple physical functions. Vigil-KV further schedules compaction/flush operations and client requests being aware of PLM’s restrictions thereby integrating strong latency determinism into LSM KVs. We implement Vigil-KV upon a 1.92TB NVMe SSD prototype and Linux 4.19.91, but other LSM KVs can adopt its concept. We evaluate diverse Facebook and Yahoo scenarios with Vigil-KV, and the results show that Vigil-KV can reducethe tail latency of a baseline KV system by 3.19\texttimes{} while reducing the average latency by 34\%, on average.",10.1145/3582695
10.1145/3583563,Actor-Driven Decomposition of Microservices through Multi-level Scalability Assessment,"Camilli, Matteo; Colarusso, Carmine; Russo, Barbara; Zimeo, Eugenio",2023,ACM Trans. Softw. Eng. Methodol.,"The microservices architectural style has gained widespread acceptance. However, designing applications according to this style is still challenging. Common difficulties concern finding clear boundaries that guide decomposition while ensuring performance and scalability. With the aim of providing software architects and engineers with a systematic methodology, we introduce a novel actor-driven decomposition strategy to complement the domain-driven design and overcome some of its limitations by reaching a finer modularization yet enforcing performance and scalability improvements. The methodology uses a multi-level scalability assessment framework that supports decision-making over iterative steps. At each iteration, architecture alternatives are quantitatively evaluated at multiple granularity levels. The assessment helps architects to understand the extent to which architecture alternatives increase or decrease performance and scalability. We applied the methodology to drive further decomposition of the core microservices of a real data-intensive smart mobility application and an existing open-source benchmark in the e-commerce domain. The results of an in-depth evaluation show that the approach can effectively support engineers in (i) decomposing monoliths or coarse-grained microservices into more scalable microservices and (ii) comparing among alternative architectures to guide decision-making for their deployment in modern infrastructures that orchestrate lightweight virtualized execution units.",10.1145/3583563
10.1145/3585009,White-Box Fuzzing RPC-Based APIs with EvoMaster: An Industrial Case Study,"Zhang, Man; Arcuri, Andrea; Li, Yonggang; Liu, Yang; Xue, Kaiming",2023,ACM Trans. Softw. Eng. Methodol.,"Remote Procedure Call (RPC) is a communication protocol to support client-server interactions among services over a network. RPC is widely applied in industry for building large-scale distributed systems, such as Microservices. Modern RPC frameworks include, for example, Thrift, gRPC, SOFARPC, and Dubbo. Testing such systems using RPC communications is very challenging, due to the complexity of distributed systems and various RPC frameworks the system could employ. To the best of our knowledge, there does not exist any tool or solution that could enable automated testing of modern RPC-based services. To fill this gap, in this article we propose the first approach in the literature, together with an open source tool, for fuzzing modern RPC-based APIs. The approach is in the context of white-box testing with search-based techniques. To tackle schema extraction of various RPC frameworks, we formulate a RPC schema specification along with a parser that allows the extraction from source code of any JVM RPC-based APIs. Then, with the extracted schema we employ a search to produce tests by maximizing white-box heuristics and newly defined heuristics specific to the RPC domain. We built our approach as an extension to an open source fuzzer (i.e., EvoMaster), and the approach has been integrated into a real industrial pipeline that could be applied to a real industrial development process for fuzzing RPC-based APIs. To assess our novel approach, we conducted an empirical study with two artificial and four industrial web services selected by our industrial partner. In addition, to further demonstrate its effectiveness and application in industrial settings, we report results of employing our tool for fuzzing another 50 industrial APIs autonomously conducted by our industrial partner in their testing processes. Results show that our novel approach is capable of enabling automated test case generation for industrial RPC-based APIs (i.e., 2 artificial and 54 industrial). We also compared with a simple gray-box technique and existing manually written tests. Our white-box solution achieves significant improvements on code coverage. Regarding fault detection, by conducting a careful review with our industrial partner of the tests generated by our novel approach in the selected four industrial APIs, a total of 41 real faults were identified, which have now been fixed. Another 8,377 detected faults are currently under investigation.",10.1145/3585009
10.1145/3586053,Randomized Testing of Byzantine Fault Tolerant Algorithms,"Winter, Levin N.; Buse, Florena; de Graaf, Daan; von Gleissenthall, Klaus; Kulahcioglu Ozkan, Burcu",2023,Proc. ACM Program. Lang.,"Byzantine fault-tolerant algorithms promise agreement on a correct value, even if a subset of processes can deviate from the algorithm arbitrarily. While these algorithms provide strong guarantees in theory, in practice, protocol bugs and implementation mistakes may still cause them to go wrong. This paper introduces ByzzFuzz, a simple yet effective method for automatically finding errors in implementations of Byzantine fault-tolerant algorithms through randomized testing. ByzzFuzz detects fault-tolerance bugs by injecting randomly generated network and process faults into their executions. To navigate the space of possible process faults, ByzzFuzz introduces small-scope message mutations which mutate the contents of the protocol messages by applying small changes to the original message either in value (e.g., by incrementing the round number) or in time (e.g., by repeating a proposal value from a previous message). We find that small-scope mutations, combined with insights from the testing and fuzzing literature, are effective at uncovering protocol logic and implementation bugs in real-world fault-tolerant systems. We implemented ByzzFuzz and applied it to test the production implementations of two popular blockchain systems, Tendermint and Ripple, and an implementation of the seminal PBFT protocol. ByzzFuzz detected several bugs in the implementation of PBFT, a potential liveness violation in Tendermint, and materialized two theoretically described vulnerabilities in Ripple’s XRP Ledger Consensus Algorithm. Moreover, we discovered a previously unknown fault-tolerance bug in the production implementation of Ripple, which is confirmed by the developers and fixed.",10.1145/3586053
10.1145/3588769,Intelligent English Language Translation And Grammar Learning Based On Internet Of Things Technology,"Chen, Yuanyuan",2023,ACM Trans. Asian Low-Resour. Lang. Inf. Process.,,10.1145/3588769
