key,title,authors,year,journal,abstract,doi
10.1007/s00165-019-00491-2,Estimating costs of multi-component enterprise applications,"Brogi, Antonio; Corradini, Andrea; Soldani, Jacopo",2019,Form. Asp. Comput.,"Estimating the cost of a multi-component application (e.g., its resource or energy consumption) is fundamental in nowadays enterprise IT, especially if we consider that current pricing models are mainly pay per-use. While this is still manageable on small applications, it is really hard to manually estimate the cost of large-scale enterprise applications involving hundreds of interdependent application components. In this article, we formalise the problem of estimating costs of multi-component applications, by representing the structure of an application as a typed directed graph, and by allowing to associate different types of costs with different application components. We show that costs can be fully customised, and that associating different costs with the same application leads to different cost estimation problems defined on that application.We then present an approach for solving cost estimation problems on multi-component applications, which is based on terminating and confluent graph transformations. We also present a prototype implemenation of our approach, which we use to run a case study based on a third-party application.",10.1007/s00165-019-00491-2
10.1109/TCBB.2019.2916810,End-to-End Security for Local and Remote Human Genetic Data Applications at the EGA,"Senf, Alexander",2019,IEEE/ACM Trans. Comput. Biol. Bioinformatics,"Sensitive genomic data should remain secure - whether on disk for storage, or analysis, or in transport. However, secure storage, delivery, and usage of genomic data is complicated by the size of files and diversity of workflows. This paper presents solutions developed by GA4GH and EGA to use custom-ized encryption, encrypted file formats, toolchain integration, and intelligent APIs to help solve this problem.",10.1109/TCBB.2019.2916810
10.1109/TNET.2020.2973800,Vehicular-OBUs-As-On-Demand-Fogs: Resource and Context Aware Deployment of Containerized Micro-Services,"Sami, Hani; Mourad, Azzam; El-Hajj, Wassim",2020,IEEE/ACM Trans. Netw.,"Observing the headway in vehicular industry, new applications are developed demanding more resources. For instance, real-time vehicular applications require fast processing of the vast amount of generated data by vehicles in order to maintain service availability and reachability while driving. Fog devices are capable of bringing cloud intelligence near the edge, making them a suitable candidate to process vehicular requests. However, their location, processing power, and technology used to host and update services affect their availability and performance while considering the mobility patterns of vehicles. In this paper, we overcome the aforementioned limitations by taking advantage of the evolvement of On-Board Units, Kubeadm Clustering, Docker Containerization, and micro-services technologies. In this context, we propose an efficient resource and context aware approach for deploying containerized micro-services on on-demand fogs called Vehicular-OBUs-As-On-Demand-Fogs. Our proposed scheme embeds (1) a Kubeadm based approach for clustering OBUs and enabling on-demand micro-services deployment with the least costs and time using Docker containerization technology, (2) a hybrid multi-layered networking architecture to maintain reachability between the requesting user and available vehicular fog cluster, and (3) a vehicular multi-objective container placement model for producing efficient vehicles selection and services distribution. An Evolutionary Memetic Algorithm is elaborated to solve our vehicular container placement problem. Experiments and simulations demonstrate the relevance and efficiency of our approach compared to other recent techniques in the literature.",10.1109/TNET.2020.2973800
10.1109/TNET.2020.2979361,Edge Federation: Towards an Integrated Service Provisioning Model,"Cao, Xiaofeng; Tang, Guoming; Guo, Deke; Li, Yan; Zhang, Weiming",2020,IEEE/ACM Trans. Netw.,"Edge computing is a promising computing paradigm by pushing the cloud service to the network edge. To this end, edge infrastructure providers (EIPs) need to bring computation and storage resources to the network edge and allow edge service providers (ESPs) to provision latency-critical services for end users. Currently, EIPs prefer to establish a series of private edge-computing environments to serve specific requirements of users. This kind of resource provisioning mechanism severely limits the development and spread of edge computing in serving diverse user requirements. In this paper, we propose an integrated resource provisioning model, named edge federation, to seamlessly realize the resource cooperation and service provisioning across standalone edge computing providers and clouds. To efficiently schedule and utilize the resources across multiple EIPs, we systematically characterize the provisioning process as a large-scale linear programming (LP) problem and transform it into an easily solved form. Accordingly, we design a dynamic algorithm to tackle the varying service demands from users. We conduct extensive experiments over the base station networks in Toronto. Compared with the fixed contract model and multihoming model, edge federation can reduce the overall costs of EIPs by 23.3\% to 24.5\%, and 15.5\% to 16.3\%, respectively.",10.1109/TNET.2020.2979361
10.1109/TNET.2020.3019098,A Coverage-Aware Resource Provisioning Method for Network Slicing,"Luu, Quang-Trung; Kerboeuf, Sylvaine; Mouradian, Alexandre; Kieffer, Michel",2020,IEEE/ACM Trans. Netw.,"With network slicing in 5G networks, Mobile Network Operators can create various slices for Service Providers (SPs) to accommodate customized services. Usually, the various Service Function Chains (SFCs) belonging to a slice are deployed on a best-effort basis. Nothing ensures that the Infrastructure Provider (InP) will be able to allocate enough resources to cope with the increasing demands of some SP. Moreover, in many situations, slices have to be deployed over some geographical area: coverage as well as minimum per-user rate constraints have then to be taken into account. This paper takes the InP perspective and proposes a slice resource &lt;italic&gt;provisioning&lt;/italic&gt; approach to cope with multiple slice demands in terms of computing, storage, coverage, and rate constraints. The resource requirements of the various SFCs within a slice are aggregated within a graph of Slice Resource Demands (SRD). Infrastructure nodes and links have then to be provisioned so as to satisfy all SRDs. This problem leads to a Mixed Integer Linear Programming formulation. A two-step approach is considered, with several variants, depending on whether the constraints of each slice to be provisioned are taken into account sequentially or jointly. Once provisioning has been performed, any slice deployment strategy may be considered on the reduced-size infrastructure graph on which resources have been provisioned. Simulation results demonstrate the effectiveness of the proposed approach compared to a more classical direct slice embedding approach.",10.1109/TNET.2020.3019098
10.1109/TNET.2021.3114448,Fast Configuration Change Impact Analysis for Network Overlay Data Center Networks,"You, Lizhao; Zhang, Jiahua; Jin, Yili; Tang, Hao; Li, Xiao",2021,IEEE/ACM Trans. Netw.,"This paper presents the first network configuration verifier that provides fast all-pair reachability analysis of incremental configuration changes for network overlay data center networks (DCNs). Network overlay DCNs leverage distributed routing protocol on edge leaf switches to disseminate overlay routes and establish overlay tunnels. In addition, network overlay DCNs use access control lists, microsegmentation policy, policy-based routing and firewall policy to control east-west and north-south traffic. Although some incremental verification approaches have been proposed, they either do not support certain forwarding features of the network, or are not efficient. Our configuration verifier addresses these issues through the following components: 1) a port predicate based forwarding model that is general to support all features; 2) fine-grained association technique to index possibly affected reachable pairs by changed interfaces in the original network; and 3) required waypoint path computation that finds all reachable pairs related to changed interfaces in the new network. Based on these components, our verifier presents two incremental verification algorithms that are specially designed for different service update cases. Experiment results show that our incremental verification algorithms are accurate and fast. For all-pair reachability, our verifier performs change-impact analysis within 15s for networks with 200 leafs (4000 subnets and 16 million pairs), outperforming existing approaches by up to 10x.",10.1109/TNET.2021.3114448
10.1109/TNET.2022.3190730,Southbound Message Delivery With Virtual Network Topology Awareness in Clouds,"Zhao, Gongming; Luo, Luyao; Xu, Hongli; Chung, Chun-Jen; Xie, Liguang",2022,IEEE/ACM Trans. Netw.,"Southbound message delivery from the control plane to the data plane is one of the essential issues in multi-tenant clouds. A natural method of southbound message delivery is that the control plane directly communicates with compute nodes in the data plane. However, due to the large number of compute nodes, this method may result in massive control overhead. The Message Queue (MQ) model can solve this challenge by aggregating and distributing messages to queues. Existing MQ-based solutions often perform message aggregation based on the physical network topology, which do not align with the fundamental requirements of southbound message delivery, leading to high message redundancy on compute nodes. To address this issue, we design and implement VITA, the first-of-its-kind work on virtual network topology-aware southbound message delivery. However, it is intractable to optimally deliver southbound messages according to the virtual attributes of messages. Thus, we design two algorithms, submodular-based approximation algorithm and simulated annealing-based algorithm, to solve different scenarios of the problem. Both experiment and simulation results show that VITA can reduce the total traffic amount of redundant messages by 45%-75% and reduce the control overhead by 33%-80% compared with state-of-the-art solutions.",10.1109/TNET.2022.3190730
10.1109/TNET.2022.3206781,Secure Inter-Container Communications Using XDP/eBPF,"Nam, Jaehyun; Lee, Seungsoo; Porras, Phillip; Yegneswaran, Vinod; Shin, Seungwon",2022,IEEE/ACM Trans. Netw.,"While the use of containerization technologies for virtual application deployment has grown at an astonishing rate, the question of the robustness of container networking has not been well scrutinized from a security perspective, even though inter-container networking is indispensable for microservices. Thus, this paper first analyzes container networks from a security perspective, discussing the implications based on their architectural limitations. Then, it presents Bastion+, a secure inter-container communication bridge. Bastion+ introduces (&lt;inline-formula&gt; &lt;tex-math notation=""LaTeX""&gt;$i$ &lt;/tex-math&gt;&lt;/inline-formula&gt;) a network security enforcement stack that provides fine-grained control per container application and securely isolates inter- container traffic in a point-to-point manner. Bastion+ also supports (&lt;inline-formula&gt; &lt;tex-math notation=""LaTeX""&gt;$ii$ &lt;/tex-math&gt;&lt;/inline-formula&gt;) selective security function chaining, enabling various security functions to be chained between containers for further security inspections (e.g., deep packet inspection) according to the container’s network context. Bastion+ incorporates (&lt;inline-formula&gt; &lt;tex-math notation=""LaTeX""&gt;$iii$ &lt;/tex-math&gt;&lt;/inline-formula&gt;) a security policy assistant that helps an administrator discover inter-container networking dependencies correctly. Our evaluation demonstrates how Bastion+ can effectively mitigate several adversarial attacks in container networks while improving the overall performance up to 25.4% within single-host containers and 17.7% for cross-host container communications.",10.1109/TNET.2022.3206781
10.1109/TNET.2022.3217280,Efficient Revenue-Based MEC Server Deployment and Management in Mobile Edge-Cloud Computing,"Zhang, Yongmin; Wang, Wei; Ren, Ju; Huang, Jinge; He, Shibo; Zhang, Yaoxue",2022,IEEE/ACM Trans. Netw.,"With the explosive growth of mobile applications, the development of mobile edge computing (MEC) has been greatly promoted since it can ably improve the quality of service for mobile applications by providing low latency and high-quality computation services. Most existing works focus on improving the efficiency of MEC with an assumption that the MEC servers have already been deployed. However, without appropriate deployment of MEC servers, the profitability of the MEC system can be significantly restrained, which hinders the rapid promotion of the MEC. To address this issue, we formulate an MEC server deployment problem for the MEC operator as a revenue maximization problem. Firstly, we model and analyze the various factors that affect the revenue. Secondly, we formulate a revenue maximization problem, which is NP-hard, but it is proved to be convex with respect to the total available computation units. Based on this feature, we propose a three-layer optimization algorithm, named EDM, in which the location, the deployed computation units, and the wholesaled computation resources are determined gradually, to maximize the total revenue. Experimental results demonstrate that the proposed EDM algorithm has significant advantages on revenue improvement compared to competitive benchmarks.",10.1109/TNET.2022.3217280
10.1109/TNET.2022.3220427,Scalable and Secure Virtualization of HSM With ScaleTrust,"Han, Juhyeng; Yun, Insu; Kim, Seongmin; Kim, Taesoo; Son, Sooel; Han, Dongsu",2022,IEEE/ACM Trans. Netw.,"Hardware security modules (HSMs) have been utilized as a trustworthy foundation for cloud services. Unfortunately, existing systems using HSMs fail to meet multi-tenant scalability arising from the emerging trends such as microservices, which utilize frequent cryptographic operations. As an alternative, cloud vendors provide HSMs as a service. However, such cloud-managed HSM usage models raise security concerns due to their untrusted and shared operating environment. We propose ScaleTrust, a scalable and secure system for key management. ScaleTrust allows us to scale the number of virtual HSM partitions, each of which is isolated with respect to each other and is robust against cloud insider attacks, while preserving physical isolation of the root of trust. To enable this, ScaleTrust uses Intel SGX and multiple HSM features, such as restricting key usage by controlling key attributes of in-HSM keys and establishing a secure channel using only HSM commands. Finally, we apply ScaleTrust to four real-world systems: Keyless SSL for TLS private key offloading, JSON Web Token authentication for microservices, key provisioning, and encryption in database systems. Our evaluation shows that ScaleTrust achieves multi-tenancy in a scalable way by providing multiple virtual HSMs with legacy HSM devices that are designed to support a single tenant. ScaleTrust provides security against insider threats while incurring 11.9% and 39.0% of end-to-end throughput and latency overhead for Keyless SSL compared to stand-alone HSMs.",10.1109/TNET.2022.3220427
10.1109/TNET.2022.3224369,Octopus: Exploiting the Edge Intelligence for Accessible 5G Mobile Performance Enhancement,"An, Congkai; Zhou, Anfu; Pei, Jialiang; Liu, Xi; Xu, Dongzhu; Liu, Liang; Ma, Huadong",2022,IEEE/ACM Trans. Netw.,"While 5G has rolled out since 2019 and exhibited versatile advantages, its performance under high/extreme mobility scenes (e.g., driving, high-speed railway or HSR) remains mysterious. In this work, we carry out a large-scale field-trial campaign, taking &gt;13,000 Km round-trips on HSR moving at 250–350 Km/h, with operational 5G cellular coverage along the railway. Our empirical study reveals that coupling interaction among high mobility, 5G handover characteristics, and applications’ sluggish reaction to handover, results in catastrophic damage to user experience: low TCP bandwidth utilization of 26.6% and glitchy 4K VoD streaming. To solve the problem, we propose an edge-assisted mobility management framework called Octopus. Different from previous works, Octopus aims at a standard-compatible and easy-to-deploy solution, thus we take a new design paradigm of exploiting the edge intelligence on multi-access edge computing (MEC). We realize Octopus as a universal MEC service ready for benefiting any third-party mobile applications. We prototype, deploy, and evaluate Octopus in operational 5G, which demonstrates the significant performance gain across the full-range mobile scenarios, e.g., HSR, driving, and walking.",10.1109/TNET.2022.3224369
10.1109/TNET.2022.3224610,Buffer-Based High-Coverage and Low-Overhead Request Event Monitoring in the Cloud,"Gao, Kaihui; Sun, Chen; Wang, Shuai; Li, Dan; Zhou, Yu; Liu, Hongqiang Harry; Zhu, Lingjun; Zhang, Ming; Deng, Xiang; Zhou, Cheng; Lu, Lu",2023,IEEE/ACM Trans. Netw.,"Request latency directly affects the performance of modern cloud applications. Due to various causes in hosts and networks, requests can suffer from request latency anomalies (RLAs), which may violate the Service-Level Agreement. However, existing performance monitoring tools have incomplete coverage and inconsistent semantics for monitoring requests and cannot accurately diagnose RLAs. This paper presents &lt;italic&gt;BufScope&lt;/italic&gt;, a high-coverage and low-overhead request event monitoring system, which monitors &lt;italic&gt;buffers&lt;/italic&gt; to capture most RLA-related abnormal events with consistent request-level semantics in the end-to-end datapath of request. First, &lt;italic&gt;BufScope&lt;/italic&gt; models the datapath of request as a buffer chain and defines events based on three properties of buffers, so as to &lt;italic&gt;end-to-end monitor&lt;/italic&gt; the root causes of RLA. Then, to achieve &lt;italic&gt;consistent semantics&lt;/italic&gt; for captured events, &lt;italic&gt;BufScope&lt;/italic&gt; designs a request-level semantics injection mechanism to make events captured in networks have the victim requests’ ID. Finally, &lt;italic&gt;BufScope&lt;/italic&gt; offloads the semantics operations and event collection in software to SmartNICs for &lt;italic&gt;low CPU overhead&lt;/italic&gt;. We have implemented &lt;italic&gt;BufScope&lt;/italic&gt; on commodity SmartNICs and programmable switches. Evaluation results show that &lt;italic&gt;BufScope&lt;/italic&gt; can diagnose 98% RLAs with &lt; 0.08% network bandwidth overhead and 0.6% application throughput decline.",10.1109/TNET.2022.3224610
10.1109/TNET.2023.3319434,Achieving Cost Optimization for Tenant Task Placement in Geo-Distributed Clouds,"Luo, Luyao; Zhao, Gongming; Xu, Hongli; Yu, Zhuolong; Xie, Liguang",2023,IEEE/ACM Trans. Netw.,"Cloud infrastructure has gradually displayed a tendency of geographical distribution in order to provide anywhere, anytime connectivity to tenants all over the world. The tenant task placement in geo-distributed clouds comes with three critical and coupled factors: regional diversity in electricity prices, access delay for tenants, and traffic demand among tasks. However, existing works disregard either the regional difference in electricity prices or the tenant requirements in geo-distributed clouds, resulting in increased operating costs or low user QoS. To bridge the gap, we design a cost optimization framework for tenant task placement in geo-distributed clouds, called TanGo. However, it is non-trivial to achieve an optimization framework while meeting all the tenant requirements. To this end, we first formulate the electricity cost minimization for task placement problem as a constrained mixed-integer non-linear programming problem. We then propose a near-optimal algorithm with a tight approximation ratio &lt;inline-formula&gt; &lt;tex-math notation=""LaTeX""&gt;$(1-1/e)$ &lt;/tex-math&gt;&lt;/inline-formula&gt; using an effective submodular-based method. Results of in-depth simulations based on real-world datasets show the effectiveness of our algorithm as well as the overall 10%-30% reduction in electricity expenses compared to commonly-adopted alternatives.",10.1109/TNET.2023.3319434
10.1109/TNET.2023.3330255,Multi-User Layer-Aware Online Container Migration in Edge-Assisted Vehicular Networks,"Tang, Zhiqing; Mou, Fangyi; Lou, Jiong; Jia, Weijia; Wu, Yuan; Zhao, Wei",2023,IEEE/ACM Trans. Netw.,"In edge-assisted vehicular networks, containers are very suitable for deploying applications and providing services due to their lightweight and rapid deployment. To provide high-quality services, many existing studies show that the containers need to be migrated to follow the vehicles’ trajectory. However, it has been conspicuously neglected by existing work that making full use of the complex layer-sharing information of containers among multiple users can significantly reduce migration latency. In this paper, we propose a novel online container migration algorithm to reduce the overall task latency. Specifically: 1) we model the multi-user layer-aware online container migration problem in edge-assisted vehicular networks, comprehensively considering the initialization latency, computation latency, and migration latency. 2) A feature extraction method based on attention and long short-term memory is proposed to fully extract the multi-user layer-sharing information. Then, a policy gradient-based reinforcement learning algorithm is proposed to make the online migration decisions. 3) The experiments are conducted with real-world data traces. Compared with the baselines, our algorithms effectively reduce the total latency by 8% to 30% on average.",10.1109/TNET.2023.3330255
10.1109/TNET.2024.3366561,"SPRIGHT: High-Performance eBPF-Based Event-Driven, Shared-Memory Processing for Serverless Computing","Qi, Shixiong; Monis, Leslie; Zeng, Ziteng; Wang, Ian-Chin; Ramakrishnan, K. K.",2024,IEEE/ACM Trans. Netw.,"Serverless computing promises an efficient, low-cost compute capability in cloud environments. However, existing solutions, epitomized by open-source platforms such as Knative, include heavyweight components that undermine this goal of serverless computing. Additionally, such serverless platforms lack dataplane optimizations to achieve efficient, high-performance function chains that facilitate the popular microservices development paradigm. Their use of unnecessarily complex and duplicate capabilities for building function chains severely degrades performance. ‘Cold-start’ latency is another deterrent. We describe SPRIGHT, a lightweight, high-performance, responsive serverless framework. SPRIGHT exploits shared memory processing and dramatically improves the scalability of the dataplane by avoiding unnecessary protocol processing and serialization-deserialization overheads. SPRIGHT extensively leverages event-driven processing with the extended Berkeley Packet Filter (eBPF). We creatively use eBPF’s socket message mechanism to support shared memory processing, with overheads being strictly load-proportional. Compared to constantly-running, polling-based DPDK, SPRIGHT achieves the same dataplane performance with &lt;inline-formula&gt; &lt;tex-math notation=""LaTeX""&gt;$10times $ &lt;/tex-math&gt;&lt;/inline-formula&gt; less CPU usage under realistic workloads. Additionally, eBPF benefits SPRIGHT, by replacing heavyweight serverless components, allowing us to keep functions ‘warm’ with negligible penalty. Our preliminary experimental results show that SPRIGHT achieves an order of magnitude improvement in throughput and latency compared to Knative, while substantially reducing CPU usage, and obviates the need for ‘cold-start’.",10.1109/TNET.2024.3366561
10.1109/TNET.2024.3393427,Graph Neural Network-Based SLO-Aware Proactive Resource Autoscaling Framework for Microservices,"Park, Jinwoo; Choi, Byungkwon; Lee, Chunghan; Han, Dongsu",2024,IEEE/ACM Trans. Netw.,"Microservice is an architectural style widely adopted in various latency-sensitive cloud applications. Similar to the monolith, autoscaling has attracted the attention of operators for managing the resource utilization of microservices. However, it is still challenging to optimize resources in terms of latency service-level-objective (SLO) without human intervention. In this paper, we present GRAF, a graph neural network-based SLO-aware proactive resource autoscaling framework for minimizing total CPU resources while satisfying latency SLO. GRAF leverages front-end workload, distributed tracing data, and machine learning approaches to (a) observe/estimate the impact of traffic change (b) find optimal resource combinations (c) make proactive resource allocation. Experiments using various open-source benchmarks demonstrate that GRAF successfully targets latency SLO while saving up to 19% of total CPU resources compared to the fine-tuned autoscaler. GRAF also handles a traffic surge with 36% fewer resources while achieving up to 2.6x faster tail latency convergence compared to the Kubernetes autoscaler. Moreover, we verify the scalability of GRAF on large-scale deployments, where GRAF saves 21.6% and 25.4% for CPU resources and memory resources, respectively.",10.1109/TNET.2024.3393427
