key,title,authors,year,journal,abstract,doi
10.1145/3664805,Technical Debt Monitoring Decision Making with Skin in the Game,"Fungprasertkul, Suwichak; Bahsoon, Rami; Kazman, Rick",2024,ACM Trans. Softw. Eng. Methodol.,"Technical Debt Management (TDM) can suffer from unpredictability, communication gaps and the inaccessibility of relevant information, which hamper the effectiveness of its decision making. These issues can stem from division among decision-makers which takes root in unfair consequences of decisions among different decision-makers. One mitigation route is Skin in the Game thinking, which enforces transparency, fairness and shared responsibility during collective decision-making under uncertainty. This article illustrates characteristics which require Skin in the Game thinking in Technical Debt (TD) identification, measurement, prioritisation and monitoring. We point out crucial problems in TD monitoring rooted in asymmetric information and asymmetric payoff between different factions of decision-makers. A systematic TD monitoring method is presented to mitigate the said problems. The method leverages Replicator Dynamics and Behavioural Learning. The method supports decision-makers with automated TD monitoring decisions; it informs decision-makers when human interventions are required. Two publicly available industrial projects with a non-trivial number of TD and timestamps are utilised to evaluate the application of our method. Mann–Whitney U hypothesis tests are conducted on samples of decisions from our method and the baseline. The statistical evidence indicates that our method can produce cost-effective and contextual TD monitoring decisions.",10.1145/3664805
10.1145/3665223,"IMAGE: An Open-Source, Extensible Framework for Deploying Accessible Audio and Haptic Renderings of Web Graphics","Regimbal, Juliette; Blum, Jeffrey R.; Kuo, Cyan; Cooperstock, Jeremy R.",2024,ACM Trans. Access. Comput.,"For accessibility practitioners, creating and deploying novel multimedia interactions for people with disabilities is a nontrivial task. As a result, many projects aiming to support such accessibility needs come and go or never make it to a public release. To reduce the overhead involved in deploying and maintaining a system that transforms web content into multimodal renderings, we created an open source, modular microservices architecture as part of the IMAGE project. This project aims to design richer means of interacting with web graphics than is afforded by a screen reader and text descriptions alone. To benefit the community of accessibility software developers, we discuss this architecture and explain how it provides support for several multimodal processing pipelines. Beyond illustrating the initial use case that motivated this effort, we further describe two use cases outside the scope of our project to explain how a team could use the architecture to develop and deploy accessible solutions for their own work. We then discuss our team’s experience working with the IMAGE architecture, informed by discussions with six project members, and provide recommendations to other practitioners considering applying the framework to their own accessibility projects.",10.1145/3665223
10.1145/3665795,Self-Supervised Machine Learning Framework for Online Container Security Attack Detection,"Tunde-Onadele, Olufogorehan; Lin, Yuhang; Gu, Xiaohui; He, Jingzhu; Latapie, Hugo",2024,ACM Trans. Auton. Adapt. Syst.,"Container security has received much research attention recently. Previous work has proposed to apply various machine learning techniques to detect security attacks in containerized applications. On one hand, supervised machine learning schemes require sufficient labeled training data to achieve good attack detection accuracy. On the other hand, unsupervised machine learning methods are more practical by avoiding training data labeling requirements, but they often suffer from high false alarm rates. In this article, we present a generic self-supervised hybrid learning (SHIL) framework for achieving efficient online security attack detection in containerized systems. SHIL can effectively combine both unsupervised and supervised learning algorithms but does not require any manual data labeling. We have implemented a prototype of SHIL and conducted experiments over 46 real-world security attacks in 29 commonly used server applications. Our experimental results show that SHIL can reduce false alarms by 33\%–93\% compared to existing supervised, unsupervised, or semi-supervised machine learning schemes while achieving a higher or similar detection rate.",10.1145/3665795
10.1145/3673897,A Toolset for Predicting Performance of Legacy Real-Time Software Based on the RAST Approach,"Tomak, Juri; Gorlatch, Sergei",2024,ACM Trans. Model. Comput. Simul.,"Simulating and predicting the performance of a distributed software system that works under stringent real-time constraints poses significant challenges, particularly when dealing with legacy systems being in production use, where any disruption is intolerable. This challenge is exacerbated in the context of a System Under Evaluation (SUE) that operates within a resource-sharing environment, running concurrently with numerous other software components. In this paper, we introduce an innovative toolset designed for predicting the performance of such complex and time-critical software systems. Our toolset builds upon the RAST (Regression Analysis, Simulation, and load Testing) approach, significantly enhanced in this paper compared to its initial version. While current state-of-the-art methods for performance prediction often rely on data collected by Application Performance Monitoring (APM), the unavailability of APM tools for existing systems and the complexities associated with integrating them into legacy software necessitate alternative approaches. Our toolset, therefore, utilizes readily accessible system request logs as a substitute for APM data. We describe the enhancements made to the original RAST approach, we outline the design and implementation of our RAST-based toolset, and we showcase its simulation accuracy and effectiveness using the publicly available TeaStore benchmarking system. To ensure the reproducibility of our experiments, we provide open access to our toolset’s implementation and the utilized TeaStore model.",10.1145/3673897
10.1145/3674726,HeMiRCA: Fine-Grained Root Cause Analysis for Microservices with Heterogeneous Data Sources,"Zhu, Zhouruixing; Lee, Cheryl; Tang, Xiaoying; He, Pinjia",2024,ACM Trans. Softw. Eng. Methodol.,"Microservices architecture improves software scalability, resilience, and agility but also poses significant challenges to system reliability due to their complexity and dynamic nature. Identifying and resolving anomalies promptly is crucial because they can quickly propagate to other microservices and cause severe damage to the system. Existing root-cause metric localization approaches rely on metrics or metrics-anomalies correlations but overlook other monitoring data sources (e.g., traces). We are the first to identify and leverage the anomaly-aware monotonic correlation between heterogeneous monitoring data, motivated by which we propose a novel framework, Heterogeneous data sources in Microservice systems for Root Cause Analysis (HeMiRCA), for hierarchical root cause analysis using Spearman correlation. HeMiRCA is based on the key observation that the microservice responsible for a particular type of fault exhibits a monotonic correlation between the trends of its associated metrics and the trace-based anomaly score of the system. HeMiRCA first calculates time-series anomaly scores using traces and then exploits the correlations between multivariate metrics and the scores to rank the suspicious metrics and microservices. HeMiRCA has been evaluated on two datasets collected from widely used microservice systems. The results show that HeMiRCA outperforms the state-of-the-art approaches by a large margin in identifying root causes at both service level and metric level, achieving a top-1 hit ratio of 82.7\% and 74\% on average, respectively.",10.1145/3674726
10.1145/3674734,Agile C-states: A Core C-state Architecture for Latency Critical Applications Optimizing both Transition and Cold-Start Latency,"Antoniou, Georgia; Bartolini, Davide; Volos, Haris; Kleanthous, Marios; Wang, Zhe; Kalaitzidis, Kleovoulos; Rollet, Tom; Li, Ziwei; Mutlu, Onur; Sazeides, Yiannakis; Haj Yahya, Jawad",2024,ACM Trans. Archit. Code Optim.,"Latency-critical applications running in modern datacenters exhibit irregular request arrival patterns and are implemented using multiple services with strict latency requirements (30–250μs). These characteristics render existing energy-saving idle CPU sleep states ineffective due to the performance overhead caused by the state’s transition latency. Besides the state transition latency, another important contributor to the performance overhead of sleep states is the cold-start latency, or in other words, the time required to warm up the microarchitectural state (e.g., cache contents, branch predictor metadata) that is flushed or discarded when transitioning to a lower-power state. Both the transition latency and cold-start latency can be particularly detrimental to the performance of latency critical applications with short execution times. While prior work focuses on mitigating the effects of transition and cold-start latency by optimizing request scheduling, in this work we propose a redesign of the core C-state architecture for latency-critical applications. In particular, we introduce C6Awarm, a new Agile core C-state that drastically reduces the performance overhead caused by idle sleep state transition latency and cold-start latency while maintaining significant energy savings. C6Awarm achieves its goals by (1) implementing medium-grained power gating, (2) preserving the microarchitectural state of the core, and (3) keeping the clock generator and PLL active and locked. Our analysis for a set of microservices based on an Intel Skylake server shows that C6Awarm manages to reduce the energy consumption by up to 70\% with limited performance degradation (at most 2\%).",10.1145/3674734
10.1145/3674972,DeGONet: Decentralized Group-Oriented Interconnection Network for IoT-enabled Metaverse,"Jiang, Sining; Cheng, Xu; Dai, Hong-Ning; Zhao, Shuo; Lan, Yujun; Xie, Haoran; Tao, Xiaohui; Guo, Zhongwen",2024,ACM Trans. Internet Technol.,"As a transformative technology across various industries, the metaverse has emerged to connect the physical world with the virtual world. During this process, the Internet of Things (IoT) has played a critical role in achieving effective cyber-physical interaction. However, its prevalent centralized interconnection architectures encounter challenges related to interoperability and data privacy, consequently limiting their full potential in human-to-human interactions. To address these challenges, this paper introduces a novel decentralized group-oriented data interconnection network for IoT systems, abbreviated as DeGONet. We propose a group-based trust management model to facilitate user adaptability in data-sharing practices. Additionally, we present a new interaction paradigm based on smart contracts and oracles. Recognizing the potential latency and scalability limitations of existing blockchain structures in large-scale data integration, we devise a novel blockchain structure called Direct Acyclic Graph Tree (DAG-Tree) and a novel consensus mechanism, Proof-of-Verification. These contributions enhance data security while mitigating the hardware and development costs associated with decentralized systems. Through rigorous performance analysis and comparative experiments, we validate the effectiveness and efficiency of our proposed framework in large-scale data interconnection scenarios.",10.1145/3674972
10.1145/3676149,Introduction to the Special Issue on W4A’22,"Rauschenberger, Maria; Eraslan, Sukru",2024,ACM Trans. Access. Comput.,,10.1145/3676149
10.1145/3676167,Dynamically Balancing Load with Overload Control for Microservices,"Bhattacharya, Ratnadeep; Gao, Yuan; Wood, Timothy",2024,ACM Trans. Auton. Adapt. Syst.,"The microservices architecture simplifies application development by breaking monolithic applications into manageable microservices. However, this distributed microservice “service mesh” leads to new challenges due to the more complex application topology. Particularly, each service component scales up and down independently creating load imbalance problems on shared backend services accessed by multiple components. Traditional load balancing algorithms do not port over well to a distributed microservice architecture where load balancers are deployed client-side. In this article, we propose a self-managing load balancing system, BLOC, which provides consistent response times to users without using a centralized metadata store or explicit messaging between nodes. BLOC uses overload control approaches to provide feedback to the load balancers. We show that this performs significantly better in solving the incast problem in microservice architectures. A critical component of BLOC is the dynamic capacity estimation algorithm. We show that a well-tuned capacity estimate can outperform even join-the-shortest-queue, a nearly optimal algorithm, while a reasonable dynamic estimate still outperforms Least Connection, a distributed implementation of join-the-shortest-queue. Evaluating this framework, we found that BLOC improves the response time distribution range, between the 10th and 90th percentiles, by 2 –4 times and the tail, 99th percentile, latency by 2 times.",10.1145/3676167
10.1145/3680463,An Empirical Study of Testing Machine Learning in the Wild,"Openja, Moses; Khomh, Foutse; Foundjem, Armstrong; Jiang, Zhen Ming (Jack); Abidi, Mouna; Hassan, Ahmed E.",2024,ACM Trans. Softw. Eng. Methodol.,"Background: Recently, machine and deep learning (ML/DL) algorithms have been increasingly adopted in many software systems. Due to their inductive nature, ensuring the quality of these systems remains a significant challenge for the research community. Traditionally, software systems were constructed deductively, by writing explicit rules that govern the behavior of the system as program code. However, ML/DL systems infer rules from training data i.e., they are generated inductively. Recent research in ML/DL quality assurance has adapted concepts from traditional software testing, such as mutation testing, to improve reliability. However, it is unclear if these proposed testing techniques are adopted in practice, or if new testing strategies have emerged from real-world ML deployments. There is little empirical evidence about the testing strategies.Aims: To fill this gap, we perform the first fine-grained empirical study on ML testing in the wild to identify the ML properties being tested, the testing strategies, and their implementation throughout the ML workflow.Method: We conducted a mixed-methods study to understand ML software testing practices. We analyzed test files and cases from 11 open-source ML/DL projects on GitHub. Using open coding, we manually examined the testing strategies, tested ML properties, and implemented testing methods to understand their practical application in building and releasing ML/DL software systems.Results: Our findings reveal several key insights: (1) The most common testing strategies, accounting for less than 40\%, are Grey-box and White-box methods, such as Negative Testing, Oracle Approximation, and Statistical Testing. (2) A wide range of (17) ML properties are tested, out of which only 20\% to 30\% are frequently tested, including Consistency, Correctness, and Efficiency. (3) Bias and Fairness is more tested in Recommendation (6\%) and Computer Vision (CV) (3.9\%) systems, while Security and Privacy is tested in CV (2\%), Application Platforms (0.9\%), and NLP (0.5\%). (4) We identified 13 types of testing methods, such as Unit Testing, Input Testing, and Model Testing.Conclusions: This study sheds light on the current adoption of software testing techniques and highlights gaps and limitations in existing ML testing practices.",10.1145/3680463
10.1145/3682076,FedRL: A Reinforcement Learning Federated Recommender System for Efficient Communication Using Reinforcement Selector and Hypernet Generator,"Di, Yicheng; Shi, Hongjian; Ma, Ruhui; Gao, Honghao; Liu, Yuan; Wang, Weiyu",2024,ACM Trans. Recomm. Syst.,"The field of recommender systems aims to predict users' latent interests by analyzing their preferences and behaviors. However, privacy concerns about user data collection lead to challenges such as incomplete initial information and data sparsity. Federated learning has emerged to address these privacy issues in recommender systems. However, federated recommender systems face heterogeneity among edge devices regarding data features and sample sizes. Moreover, differences in computational and storage capabilities introduce communication overhead and processing delays during parameter aggregation at the third-party server. This paper introduces a framework named A Reinforcement Learning Federated Recommender System for Efficient Communication Using Reinforcement Selector and Hypernet Generator (FedRL) to address the proposed issues. The Reinforcement Selector (RLS) dynamically selects participating edge devices and helps maximize their use of local data resources. Meanwhile, the Hypernet Generator (HNG) optimizes communication bandwidth consumption during the federated learning parameter transmission, enabling rapid deployment and updates of new model architectures or hyperparameters. Furthermore, the framework incorporates item attributes as content embeddings in edge devices' recommender models, enriching them with global information. Real-world dataset experiments demonstrate that the proposed solution balances recommender quality and communication efficiency. The code for this work is publicly available on GitHub: .",10.1145/3682076
10.1145/3685694,Exploring Indoor Air Quality Dynamics in Developing Nations: A Perspective from India,"Karmakar, Prasenjit; Pradhan, Swadhin; Chakraborty, Sandip",2024,ACM J. Comput. Sustain. Soc.,"Indoor air pollution is a major issue in developing countries such as India and Bangladesh, exacerbated by factors such as traditional cooking methods, insufficient ventilation, and cramped living conditions, all of which elevate the risk of health issues such as lung infections and cardiovascular diseases. With the World Health Organization associating around 3.2 million annual deaths globally to household air pollution, the gravity of the problem is clear. Yet, extensive empirical studies exploring these unique patterns and indoor pollution’s extent are missing. To fill this gap, we carried out a 6-months long field study involving over 30 households, uncovering the complexity of indoor air pollution in developing countries, such as the longer lingering time of volatile organic compounds (VOCs) in the air or the significant influence of air circulation on the spatiotemporal distribution of pollutants. We introduced an innovative Internet of Things (IoT) air quality sensing platform, the Distributed Air QuaLiTy MONitor (DALTON), explicitly designed to meet the needs of these nations, considering factors such as cost, sensor type, accuracy, network connectivity, power, and usability. As a result of a multi-device deployment, the platform identifies pollution hot spots in low- and middle-income households in developing nations. It identifies best practices to minimize daily indoor pollution exposure. Our extensive qualitative survey estimates an overall system usability score of 2.04, indicating an efficient system for air quality monitoring.",10.1145/3685694
10.1145/3685930,Cost-Efficient Deep Neural Network Placement in Edge Intelligence-Enabled Internet of Things,"Tian, Hao; Xu, Xiaolong; Wu, Hongyue; Zhao, Qingzhan; Dai, Jianguo; Khan, Maqbool",2024,ACM Trans. Sen. Netw.,"Edge intelligence (EI) integrates edge computing and artificial intelligence empowering service providers to deploy deep neural networks (DNNs) on edge servers in proximity to users to provision intelligent applications (e.g., autonomous driving) for ubiquitous Internet of Things (IoT) in smart cities, which facilitates the quality of experience (QoE) of users and improves the processing and energy efficiency. However, considering DNN is typically computational-intensive and resource-hungry, conventional placement approaches ignore the influence of multi-dimensional resource requirements (processor, memory, etc.), which may degrade the real-time performance. Moreover, with the increasing scale of geo-distributed edge servers, centralized decision-making is still challenging to find the optimal strategies effectively. To overcome these shortcomings, in this paper we propose a game theoretic DNN placement approach in EI-enabled IoT. First, a DNN placement optimization problem is formulated to maximize system benefits, which is proven to be (mathcal {N}mathcal {P} ) -hard and model the original problem as an exact potential game (EPG). Moreover, an EPG-based DNN model placement algorithm, named EPOL, is designed for edge servers to make sub-optimal strategies independently and theoretical analysis is possessed to guarantee the performance of EPOL. Finally, real-world dataset based experimental results corroborate the superiority and effectiveness of EPOL.",10.1145/3685930
10.1145/3686154,A Reversible Perspective on Petri Nets and Event Structures,"Melgratti, Hern\'{a}n; Mezzina, Claudio Antares; Pinna, G. Michele",2024,ACM Trans. Comput. Logic,"Event structures have emerged as a foundational model for concurrent computation, explaining computational processes by outlining the events and the relationships that dictate their execution. They play a pivotal role in the study of key aspects of concurrent computation models, such as causality and independence, and have found applications across a broad range of languages and models, spanning realms like persistence, probabilities, and quantum computing. Recently, event structures have been extended to address reversibility, where computational processes can undo previous computations. In this context, reversible event structures provide abstract representations of processes capable of both forward and backward steps in a computation. Since their introduction, event structures have played a crucial role in bridging operational models, traditionally exemplified by Petri nets and process calculi, with denotational ones, i.e., algebraic domains. In this context, we revisit the standard connection between Petri nets and event structures under the lenses of reversibility. Specifically, we introduce a subset of contextual Petri nets, dubbed reversible causal nets, that precisely correspond to reversible prime event structures. The distinctive feature of reversible causal nets lies in deriving causality from inhibitor arcs, departing from the conventional dependence on the overlap between the postset and preset of transitions. In this way, we are able to operationally explain the full model of reversible prime event structures.",10.1145/3686154
10.1145/3686161,EdgeStreaming: Secure Computation Intelligence in Distributed Edge Networks for Streaming Analytics,"Ye, Peigen; Wang, Wenfeng; Mi, Bing; Chen, Kongyang",2024,ACM Trans. Multimedia Comput. Commun. Appl.,"In modern information systems, real-time streaming data are generated in various vertical application scenarios, such as industrial security cameras, household intelligent devices, mobile robots and among others. However, these low-end devices can hardly provide real-time and accurate data analysis functionalities due to their limited on-board performances. Traditional centralized server computing also suffers from its prolonged transmission latency, resulting in huge response time. To deal with this problem, this paper presents a novel distributed computation intelligent system with nearby edge devices, abbreviated as EdgeStreaming, to facilitate rapid and accurate analysis of streaming data. Firstly, we thoroughly explore the available edge devices surrounding the terminal to generate an internally interconnected edge network. This edge network real-time perceives and updates the internal resource status of each edge device, such as computational and storage resources. Dynamic allocation of external computational or storage demands can be made based on the current load of individual edge devices. Consequently, the streaming data perceived by external terminal devices can be transmitted in real-time to any edge gateway. The edge network employs a well-designed task scheduling strategy to partition and allocate streaming data processing demands to one or multiple edge devices. Additionally, it customizes computational requirements judiciously, for instance, by utilizing model compression to expedite computation speed. We deployed an edge network comprising multiple Raspberry Pis, NVIDIA Jetson Nano, and Jetson NVIDIA TX2 devices, successfully achieving real-time analysis and detection of video streaming data. We believe our work provides new technological support for the real-time processing of streaming data.",10.1145/3686161
