key,title,authors,year,journal,abstract,doi
10.1145/3425866,Operating Systems for Resource-adaptive Intelligent Software: Challenges and Opportunities,"Liu, Xuanzhe; Wang, Shangguang; Ma, Yun; Zhang, Ying; Mei, Qiaozhu; Liu, Yunxin; Huang, Gang",2021,ACM Trans. Internet Technol.,"The past decades witnessed the fast and wide deployment of Internet. The Internet has bred the ubiquitous computing environment that is spanning the cloud, edge, mobile devices, and IoT. Software running over such a ubiquitous computing environment environment is eating the world. A recently emerging trend of Internet-based software systems is “resource adaptive,” i.e., software systems should be robust and intelligent enough to the changes of heterogeneous resources, both physical and logical, provided by their running environment. To keep pace of such a trend, we argue that some considerations should be taken into account for the future operating system design and implementation. From the structural perspective, rather than the “monolithic OS” that manages the aggregated resources on the single machine, the OS should be dynamically composed over the distributed resources and flexibly adapt to the resource and environment changes. Meanwhile, the OS should leverage advanced machine/deep learning techniques to derive configurations and policies and automatically learn to tune itself and schedule resources. This article envisions our recent thinking of the new OS abstraction, namely, ServiceOS, for future resource-adaptive intelligent software systems. The idea of ServiceOS is inspired by the delivery model of “Software-as-a-Service” that is supported by the Service-Oriented Architecture (SOA). The key principle of ServiceOS is based on resource disaggregation, resource provisioning as a service, and learning-based resource scheduling and allocation. The major goal of this article is not providing an immediately deployable OS. Instead, we aim to summarize the challenges and potentially promising opportunities and try to provide some practical implications for researchers and practitioners.",10.1145/3425866
10.1145/3434178,Opportunistic Collective Experiences: Identifying Shared Situations and Structuring Shared Activities at Distance,"Louie, Ryan; Garg, Kapil; Werner, Jennie; Sun, Allison; Gergle, Darren; Zhang, Haoqi",2021,Proc. ACM Hum.-Comput. Interact.,"Despite many available social technologies for connecting at a distance, we don't always find opportunities to actively engage in shared experiences and activities with friends and loved ones, even though this kind of interaction is associated with increased social closeness. To better support active engagement in shared experiences and activities while also making it convenient to find opportunities for interacting in this way, our work explores the design of Opportunistic Collective Experiences (OCEs), or social experiences powered by computer programs that identify opportune moments when users share situations across distance and structure shared activities in those situations. To support interacting with, programming, and executing OCEs, we developed Cerebro, a computational platform that consists of a mobile app that supports users? social interaction, an API for expressing the situations and activities that make up the interactional opportunity, and an opportunistic execution engine that checks for interactional opportunities and executes them when possible. Through a 20 day deployment study tested with groups of geographically-distributed college alumni (N=21), we found that OCEs promoted opportunities for active engagement; facilitated interactions that were socially connecting by structuring ways to engage in shared experiences and activities; and made actively engaging easier by identifying situations appropriate for interacting and structuring how to engage in activities in these situations. We contribute to CSCW (1) a novel interaction that facilitates engaging in shared experiences and activities at distance during coincidental moments; and (2) the design of systems to interact with, program, and execute these kinds of interactions.",10.1145/3434178
10.1145/3439769,Automatic API Usage Scenario Documentation from Technical Q&amp;A Sites,"Uddin, Gias; Khomh, Foutse; Roy, Chanchal K.",2021,ACM Trans. Softw. Eng. Methodol.,"The online technical Q&amp;A site Stack Overflow (SO) is popular among developers to support their coding and diverse development needs. To address shortcomings in API official documentation resources, several research works have thus focused on augmenting official API documentation with insights (e.g., code examples) from SO. The techniques propose to add code examples/insights about APIs into its official documentation. Recently, surveys of software developers find that developers in SO consider the combination of code examples and reviews about APIs as a form of API documentation, and that they consider such a combination to be more useful than official API documentation when the official resources can be incomplete, ambiguous, incorrect, and outdated. Reviews are opinionated sentences with positive/negative sentiments. However, we are aware of no previous research that attempts to automatically produce API documentation from SO by considering both API code examples and reviews. In this article, we present two novel algorithms that can be used to automatically produce API documentation from SO by combining code examples and reviews towards those examples. The first algorithm is called statistical documentation, which shows the distribution of positivity and negativity around the code examples of an API using different metrics (e.g., star ratings). The second algorithm is called concept-based documentation, which clusters similar and conceptually relevant usage scenarios. An API usage scenario contains a code example, a textual description of the underlying task addressed by the code example, and the reviews (i.e., opinions with positive and negative sentiments) from other developers towards the code example. We deployed the algorithms in Opiner, a web-based platform to aggregate information about APIs from online forums. We evaluated the algorithms by mining all Java JSON-based posts in SO and by conducting three user studies based on produced documentation from the posts. The first study is a survey, where we asked the participants to compare our proposed algorithms against a Javadoc-syle documentation format (called as Type-based documentation in Opiner). The participants were asked to compare along four development scenarios (e.g., selection, documentation). The participants preferred our proposed two algorithms over type-based documentation. In our second user study, we asked the participants to complete four coding tasks using Opiner and the API official and informal documentation resources. The participants were more effective and accurate while using Opiner. In a subsequent survey, more than 80\% of participants asked the Opiner documentation platform to be integrated into the formal API documentation to complement and improve the API official documentation.",10.1145/3439769
10.1145/3444692,A Survey on Edge Performance Benchmarking,"Varghese, Blesson; Wang, Nan; Bermbach, David; Hong, Cheol-Ho; Lara, Eyal De; Shi, Weisong; Stewart, Christopher",2021,ACM Comput. Surv.,"Edge computing is the next Internet frontier that will leverage computing resources located near users, sensors, and data stores to provide more responsive services. Therefore, it is envisioned that a large-scale, geographically dispersed, and resource-rich distributed system will emerge and play a key role in the future Internet. However, given the loosely coupled nature of such complex systems, their operational conditions are expected to change significantly over time. In this context, the performance characteristics of such systems will need to be captured rapidly, which is referred to as performance benchmarking, for application deployment, resource orchestration, and adaptive decision-making. Edge performance benchmarking is a nascent research avenue that has started gaining momentum over the past five years. This article first reviews articles published over the past three decades to trace the history of performance benchmarking from tightly coupled to loosely coupled systems. It then systematically classifies previous research to identify the system under test, techniques analyzed, and benchmark runtime in edge performance benchmarking.",10.1145/3444692
10.1145/3447868,"The Programmable Data Plane: Abstractions, Architectures, Algorithms, and Applications","Michel, Oliver; Bifulco, Roberto; R\'{e}tv\'{a}ri, G\'{a}bor; Schmid, Stefan",2021,ACM Comput. Surv.,"Programmable data plane technologies enable the systematic reconfiguration of the low-level processing steps applied to network packets and are key drivers toward realizing the next generation of network services and applications. This survey presents recent trends and issues in the design and implementation of programmable network devices, focusing on prominent abstractions, architectures, algorithms, and applications proposed, debated, and realized over the past years. We elaborate on the trends that led to the emergence of this technology and highlight the most important pointers from the literature, casting different taxonomies for the field, and identifying avenues for future research.",10.1145/3447868
10.1145/3448976,A Survey of Software Log Instrumentation,"Chen, Boyuan; Jiang, Zhen Ming (Jack)",2021,ACM Comput. Surv.,"Log messages have been used widely in many software systems for a variety of purposes during software development and field operation. There are two phases in software logging: log instrumentation and log management. Log instrumentation refers to the practice that developers insert logging code into source code to record runtime information. Log management refers to the practice that operators collect the generated log messages and conduct data analysis techniques to provide valuable insights of runtime behavior. There are many open source and commercial log management tools available. However, their effectiveness highly depends on the quality of the instrumented logging code, as log messages generated by high-quality logging code can greatly ease the process of various log analysis tasks (e.g., monitoring, failure diagnosis, and auditing). Hence, in this article, we conducted a systematic survey on state-of-the-art research on log instrumentation by studying 69 papers between 1997 and 2019. In particular, we have focused on the challenges and proposed solutions used in the three steps of log instrumentation: (1) logging approach; (2) logging utility integration; and (3) logging code composition. This survey will be useful to DevOps practitioners and researchers who are interested in software logging.",10.1145/3448976
10.1145/3456630,On the Use of Intelligent Models towards Meeting the Challenges of the Edge Mesh,"Oikonomou, Panagiotis; Karanika, Anna; Anagnostopoulos, Christos; Kolomvatsos, Kostas",2021,ACM Comput. Surv.,"Nowadays, we are witnessing the advent of the Internet of Things (IoT) with numerous devices performing interactions between them or with their environment. The huge number of devices leads to huge volumes of data that demand the appropriate processing. The “legacy” approach is to rely on Cloud where increased computational resources can realize any desired processing. However, the need for supporting real-time applications requires a reduced latency in the provision of outcomes. Edge Computing (EC) comes as the “solver” of the latency problem. Various processing activities can be performed at EC nodes having direct connection with IoT devices. A number of challenges should be met before we conclude a fully automated ecosystem where nodes can cooperate or understand their status to efficiently serve applications. In this article, we perform a survey of the relevant research activities towards the vision of Edge Mesh (EM), i.e., a “cover” of intelligence upon the EC. We present the necessary hardware and discuss research outcomes in every aspect of EC/EM nodes functioning. We present technologies and theories adopted for data, tasks, and resource management while discussing how machine learning and optimization can be adopted in the domain.",10.1145/3456630
10.1145/3460013,SWARM: Adaptive Load Balancing in Distributed Streaming Systems for Big Spatial Data,"Daghistani, Anas; Aref, Walid G.; Ghafoor, Arif; Mahmood, Ahmed R.",2021,ACM Trans. Spatial Algorithms Syst.,"The proliferation of GPS-enabled devices has led to the development of numerous location-based services. These services need to process massive amounts of streamed spatial data in real-time. The current scale of spatial data cannot be handled using centralized systems. This has led to the development of distributed spatial streaming systems. Existing systems are using static spatial partitioning to distribute the workload. In contrast, the real-time streamed spatial data follows non-uniform spatial distributions that are continuously changing over time. Distributed spatial streaming systems need to react to the changes in the distribution of spatial data and queries. This article introduces SWARM, a lightweight adaptivity protocol that continuously monitors the data and query workloads across the distributed processes of the spatial data streaming system and redistributes and rebalances the workloads as soon as performance bottlenecks get detected. SWARM is able to handle multiple query-execution and data-persistence models. A distributed streaming system can directly use SWARM to adaptively rebalance the system’s workload among its machines with minimal changes to the original code of the underlying spatial application. Extensive experimental evaluation using real and synthetic datasets illustrate that, on average, SWARM achieves 2 improvement in throughput over a static grid partitioning that is determined based on observing a limited history of the data and query workloads. Moreover, SWARM reduces execution latency on average 4 compared with the other technique.",10.1145/3460013
10.1145/3460345,A Survey on Automated Log Analysis for Reliability Engineering,"He, Shilin; He, Pinjia; Chen, Zhuangbin; Yang, Tianyi; Su, Yuxin; Lyu, Michael R.",2021,ACM Comput. Surv.,"Logs are semi-structured text generated by logging statements in software source code. In recent decades, software logs have become imperative in the reliability assurance mechanism of many software systems, because they are often the only data available that record software runtime information. As modern software is evolving into a large scale, the volume of logs has increased rapidly. To enable effective and efficient usage of modern software logs in reliability engineering, a number of studies have been conducted on automated log analysis. This survey presents a detailed overview of automated log analysis research, including how to automate and assist the writing of logging statements, how to compress logs, how to parse logs into structured event templates, and how to employ logs to detect anomalies, predict failures, and facilitate diagnosis. Additionally, we survey work that releases open-source toolkits and datasets. Based on the discussion of the recent advances, we present several promising future directions toward real-world and next-generation automated log analysis.",10.1145/3460345
10.1145/3460818,Cloud-based Network Virtualization in IoT with OpenStack,"Benomar, Zakaria; Longo, Francesco; Merlino, Giovanni; Puliafito, Antonio",2021,ACM Trans. Internet Technol.,"In Cloud computing deployments, specifically in the Infrastructure-as-a-Service (IaaS) model, networking is one of the core enabling facilities provided for the users. The IaaS approach ensures significant flexibility and manageability, since the networking resources and topologies are entirely under users’ control. In this context, considerable efforts have been devoted to promoting the Cloud paradigm as a suitable solution for managing IoT environments. Deep and genuine integration between the two ecosystems, Cloud and IoT, may only be attainable at the IaaS level. In light of extending the IoT domain capabilities’ with Cloud-based mechanisms akin to the IaaS Cloud model, network virtualization is a fundamental enabler of infrastructure-oriented IoT deployments. Indeed, an IoT deployment without networking resilience and adaptability makes it unsuitable to meet user-level demands and services’ requirements. Such a limitation makes the IoT-based services adopted in very specific and statically defined scenarios, thus leading to limited plurality and diversity of use cases. This article presents a Cloud-based approach for network virtualization in an IoT context using the de-facto standard IaaS middleware, OpenStack, and its networking subsystem, Neutron. OpenStack is being extended to enable the instantiation of virtual/overlay networks between Cloud-based instances (e.g., virtual machines, containers, and bare metal servers) and/or geographically distributed IoT nodes deployed at the network edge.",10.1145/3460818
10.1145/3461011,Software Architectural Migration: An Automated Planning Approach,"Chondamrongkul, Nacha; Sun, Jing; Warren, Ian",2021,ACM Trans. Softw. Eng. Methodol.,"Software architectural designs are usually changed over time to support emerging technologies and to adhere to new principles. Architectural migration is an important activity that helps to transform the architectural styles applied during a system’s design with the result of modernising the system. If not performed correctly, this process could lead to potential system failures. This article presents an automated approach to refactoring architectural design and to planning the evolution process. With our solution, the architectural design can be refactored, ensuring that system functionality is preserved. Furthermore, the architectural migration process allows the system to be safely and incrementally transformed. We have evaluated our approach with five real-world software applications. The results prove the effectiveness of our approach and identify factors that impact the performance of architectural verification and migration planning. An interesting finding is that planning algorithms generate migration plans that differ in term of their relative efficiency.",10.1145/3461011
10.1145/3464305,Evaluation of Software Architectures under Uncertainty: A Systematic Literature Review,"Sobhy, Dalia; Bahsoon, Rami; Minku, Leandro; Kazman, Rick",2021,ACM Trans. Softw. Eng. Methodol.,"Context: Evaluating software architectures in uncertain environments raises new challenges, which require continuous approaches. We define continuous evaluation as multiple evaluations of the software architecture that begins at the early stages of the development and is periodically and repeatedly performed throughout the lifetime of the software system. Numerous approaches have been developed for continuous evaluation; to handle dynamics and uncertainties at run-time, over the past years, these approaches are still very few, limited, and lack maturity. Objective: This review surveys efforts on architecture evaluation and provides a unified terminology and perspective on the subject. Method: We conducted a systematic literature review to identify and analyse architecture evaluation approaches for uncertainty including continuous and non-continuous, covering work published between 1990–2020. We examined each approach and provided a classification framework for this field. We present an analysis of the results and provide insights regarding open challenges. Major results and conclusions: The survey reveals that most of the existing architecture evaluation approaches typically lack an explicit linkage between design-time and run-time. Additionally, there is a general lack of systematic approaches on how continuous architecture evaluation can be realised or conducted. To remedy this lack, we present a set of necessary requirements for continuous evaluation and describe some examples.",10.1145/3464305
10.1145/3464940,Adaptive Hypermutation for Search-Based System Test Generation: A Study on REST APIs with EvoMaster,"Zhang, Man; Arcuri, Andrea",2021,ACM Trans. Softw. Eng. Methodol.,"REST web services are widely popular in industry, and search techniques have been successfully used to automatically generate system-level test cases for those systems. In this article, we propose a novel mutation operator which is designed specifically for test generation at system-level, with a particular focus on REST APIs. In REST API testing, and often in system testing in general, an individual can have a long and complex chromosome. Furthermore, there are two specific issues: (1) fitness evaluation in system testing is highly costly compared with the number of objectives (e.g., testing targets) to optimize for; and (2) a large part of the genotype might have no impact on the phenotype of the individuals (e.g., input data that has no impact on the execution flow in the tested program). Due to these issues, it might be not suitable to apply a typical low mutation rate like 1/n (where n is the number of genes in an individual), which would lead to mutating only one gene on average. Therefore, in this article, we propose an adaptive weight-based hypermutation, which is aware of the different characteristics of the mutated genes. We developed adaptive strategies that enable the selection and mutation of genes adaptively based on their fitness impact and mutation history throughout the search. To assess our novel proposed mutation operator, we implemented it in the EvoMaster tool, integrated in the MIO algorithm, and further conducted an empirical study with three artificial REST APIs and four real-world REST APIs. Results show that our novel mutation operator demonstrates noticeable improvements over the default MIO. It provides a significant improvement in performance for six out of the seven case studies, where the relative improvement is up to +12.09\% for target coverage, +12.69\% for line coverage, and +32.51\% for branch coverage.",10.1145/3464940
10.1145/3465630,Optimizing the Performance of Containerized Cloud Software Systems Using Adaptive PID Controllers,"Sabuhi, Mikael; Mahmoudi, Nima; Khazaei, Hamzeh",2021,ACM Trans. Auton. Adapt. Syst.,"Control theory has proven to be a practical approach for the design and implementation of controllers, which does not inherit the problems of non-control theoretic controllers due to its strong mathematical background. State-of-the-art auto-scaling controllers suffer from one or more of the following limitations: (1) lack of a reliable performance model, (2) using a performance model with low scalability, tractability, or fidelity, (3) being application- or architecture-specific leading to low extendability, and (4) no guarantee on their efficiency. Consequently, in this article, we strive to mitigate these problems by leveraging an adaptive controller, which is composed of a neural network as the performance model and a Proportional-Integral-Derivative (PID) controller as the scaling engine. More specifically, we design, implement, and analyze different flavours of these adaptive and non-adaptive controllers, and we compare and contrast them against each other to find the most suitable one for managing containerized cloud software systems at runtime. The controller’s objective is to maintain the response time of the controlled software system in a pre-defined range, and meeting the Service-level Agreements, while leading to efficient resource provisioning.",10.1145/3465630
10.1145/3466696,Autonomic Security Management for IoT Smart Spaces,"Lin, Changyuan; Khazaei, Hamzeh; Walenstein, Andrew; Malton, Andrew",2021,ACM Trans. Internet Things,"Embedded sensors and smart devices have turned the environments around us into smart spaces that could automatically evolve, depending on the needs of users, and adapt to the new conditions. While smart spaces are beneficial and desired in many aspects, they could be compromised and expose privacy, security, or render the whole environment a hostile space in which regular tasks cannot be accomplished anymore. In fact, ensuring the security of smart spaces is a very challenging task due to the heterogeneity of devices, vast attack surface, and device resource limitations. The key objective of this study is to minimize the manual work in enforcing the security of smart spaces by leveraging the autonomic computing paradigm in the management of IoT environments. More specifically, we strive to build an autonomic manager that can monitor the smart space continuously, analyze the context, plan and execute countermeasures to maintain the desired level of security, and reduce liability and risks of security breaches. We follow the microservice architecture pattern and propose a generic ontology named Secure Smart Space Ontology (SSSO) for describing dynamic contextual information in security-enhanced smart spaces. Based on SSSO, we build an autonomic security manager with four layers that continuously monitors the managed spaces, analyzes contextual information and events, and automatically plans and implements adaptive security policies.As the evaluation, focusing on a current BlackBerry customer problem, we deployed the proposed autonomic security manager to maintain the security of a smart conference room with 32 devices and 66 services. The high performance of the proposed solution was also evaluated on a large-scale deployment with over 1.8 million triples.",10.1145/3466696
