key,title,authors,year,journal,abstract,doi
10.1145/3539606,"Kubernetes Scheduling: Taxonomy, Ongoing Issues and Challenges","Carri\'{o}n, Carmen",2022,ACM Comput. Surv.,"Continuous integration enables the development of microservices-based applications using container virtualization technology. Container orchestration systems such as Kubernetes, which has become the de facto standard, simplify the deployment of container-based applications. However, developing efficient and well-defined orchestration systems is a challenge. This article focuses specifically on the scheduler, a key orchestrator task that assigns physical resources to containers. Scheduling approaches are designed based on different Quality of Service (QoS) parameters to provide limited response time, efficient energy consumption, better resource utilization, and other things. This article aims to establish insight knowledge into Kubernetes scheduling, find the main gaps, and thus guide future research in the area. Therefore, we conduct a study of empirical research on Kubernetes scheduling techniques and present a new taxonomy for Kubernetes scheduling. The challenges, future direction, and research opportunities are also discussed.",10.1145/3539606
10.1145/3549539,Focused Layered Performance Modelling by Aggregation,"Islam, Farhana; Petriu, Dorina; Woodside, Murray",2022,ACM Trans. Model. Perform. Eval. Comput. Syst.,"Performance models of server systems, based on layered queues, may be very complex. This is particularly true for cloud-based systems based on microservices, which may have hundreds of distinct components, and for models derived by automated data analysis. Often only a few of these many components determine the system performance, and a smaller simplified model is all that is needed. To assist an analyst, this work describes a focused model that includes the important components (the focus) and aggregates the rest in groups, called dependency groups. The method Focus-based Simplification with Preservation of Tasks described here fills an important gap in a previous method by the same authors. The use of focused models for sensitivity predictions is evaluated empirically in the article on a large set of randomly generated models. It is found that the accuracy depends on a “saturation ratio” (SR) between the highest utilization value in the model and the highest value of a component excluded from the focus; evidence suggests that SR must be at least 2 and must be larger to evaluate larger model changes. This dependency was captured in an “Accurate Sensitivity Hypothesis” based on SR, which can be used to indicate trustable sensitivity results.",10.1145/3549539
10.1145/3583563,Actor-Driven Decomposition of Microservices through Multi-level Scalability Assessment,"Camilli, Matteo; Colarusso, Carmine; Russo, Barbara; Zimeo, Eugenio",2023,ACM Trans. Softw. Eng. Methodol.,"The microservices architectural style has gained widespread acceptance. However, designing applications according to this style is still challenging. Common difficulties concern finding clear boundaries that guide decomposition while ensuring performance and scalability. With the aim of providing software architects and engineers with a systematic methodology, we introduce a novel actor-driven decomposition strategy to complement the domain-driven design and overcome some of its limitations by reaching a finer modularization yet enforcing performance and scalability improvements. The methodology uses a multi-level scalability assessment framework that supports decision-making over iterative steps. At each iteration, architecture alternatives are quantitatively evaluated at multiple granularity levels. The assessment helps architects to understand the extent to which architecture alternatives increase or decrease performance and scalability. We applied the methodology to drive further decomposition of the core microservices of a real data-intensive smart mobility application and an existing open-source benchmark in the e-commerce domain. The results of an in-depth evaluation show that the approach can effectively support engineers in (i) decomposing monoliths or coarse-grained microservices into more scalable microservices and (ii) comparing among alternative architectures to guide decision-making for their deployment in modern infrastructures that orchestrate lightweight virtualized execution units.",10.1145/3583563
10.1145/3585009,White-Box Fuzzing RPC-Based APIs with EvoMaster: An Industrial Case Study,"Zhang, Man; Arcuri, Andrea; Li, Yonggang; Liu, Yang; Xue, Kaiming",2023,ACM Trans. Softw. Eng. Methodol.,"Remote Procedure Call (RPC) is a communication protocol to support client-server interactions among services over a network. RPC is widely applied in industry for building large-scale distributed systems, such as Microservices. Modern RPC frameworks include, for example, Thrift, gRPC, SOFARPC, and Dubbo. Testing such systems using RPC communications is very challenging, due to the complexity of distributed systems and various RPC frameworks the system could employ. To the best of our knowledge, there does not exist any tool or solution that could enable automated testing of modern RPC-based services. To fill this gap, in this article we propose the first approach in the literature, together with an open source tool, for fuzzing modern RPC-based APIs. The approach is in the context of white-box testing with search-based techniques. To tackle schema extraction of various RPC frameworks, we formulate a RPC schema specification along with a parser that allows the extraction from source code of any JVM RPC-based APIs. Then, with the extracted schema we employ a search to produce tests by maximizing white-box heuristics and newly defined heuristics specific to the RPC domain. We built our approach as an extension to an open source fuzzer (i.e., EvoMaster), and the approach has been integrated into a real industrial pipeline that could be applied to a real industrial development process for fuzzing RPC-based APIs. To assess our novel approach, we conducted an empirical study with two artificial and four industrial web services selected by our industrial partner. In addition, to further demonstrate its effectiveness and application in industrial settings, we report results of employing our tool for fuzzing another 50 industrial APIs autonomously conducted by our industrial partner in their testing processes. Results show that our novel approach is capable of enabling automated test case generation for industrial RPC-based APIs (i.e., 2 artificial and 54 industrial). We also compared with a simple gray-box technique and existing manually written tests. Our white-box solution achieves significant improvements on code coverage. Regarding fault detection, by conducting a careful review with our industrial partner of the tests generated by our novel approach in the selected four industrial APIs, a total of 41 real faults were identified, which have now been fixed. Another 8,377 detected faults are currently under investigation.",10.1145/3585009
10.1145/3592598,Placement of Microservices-based IoT Applications in Fog Computing: A Taxonomy and Future Directions,"Pallewatta, Samodha; Kostakos, Vassilis; Buyya, Rajkumar",2023,ACM Comput. Surv.,"The Fog computing paradigm utilises distributed, heterogeneous and resource-constrained devices at the edge of the network for efficient deployment of latency-critical and bandwidth-hungry IoT application services. Moreover, MicroService Architecture (MSA) is increasingly adopted to keep up with the rapid development and deployment needs of fast-evolving IoT applications. Due to the fine-grained modularity of the microservices and their independently deployable and scalable nature, MSA exhibits great potential in harnessing Fog and Cloud resources, thus giving rise to novel paradigms like Osmotic computing. The loosely coupled nature of the microservices, aided by the container orchestrators and service mesh technologies, enables the dynamic composition of distributed and scalable microservices to achieve diverse performance requirements of the IoT applications using distributed Fog resources. To this end, efficient placement of microservice plays a vital role, and scalable placement algorithms are required to utilise the said characteristics of the MSA while overcoming novel challenges introduced by the architecture. Thus, we present a comprehensive taxonomy of recent literature on microservices-based IoT applications placement within Fog computing environments. Furthermore, we organise multiple taxonomies to capture the main aspects of the placement problem, analyse and classify related works, identify research gaps within each category, and discuss future research directions.",10.1145/3592598
10.1145/3611312,Strega: An HTTP Server for FPGAs,"Maschi, Fabio; Alonso, Gustavo",2024,ACM Trans. Reconfigurable Technol. Syst.,"The computer architecture landscape is being reshaped by the new opportunities, challenges, and constraints brought by the cloud. On the one hand, high-level applications profit from specialised hardware to boost their performance and reduce deployment costs. On the other hand, cloud providers maximise the CPU time allocated to client applications by offloading infrastructure tasks to hardware accelerators. While it is well understood how to do this for, e.g., network function virtualisation and protocols such as TCP/IP, support for higher networking layers is still largely missing, limiting the potential of accelerators. In this article, we present Strega, an open source1 light-weight Hypertext Transfer Protocol (HTTP) server that enables crucial functionality such as FPGA-accelerated functions being called through a RESTful protocol (FPGA-as-a-Function). Our experimental analysis shows that a single Strega node sustains a throughput of 1.7&nbsp;M HTTP requests per second with an end-to-end latency as low as 16, μs, outperforming nginx running on 32 vCPUs in both metrics, and can even be an alternative to the traditional OpenCL flow over the PCIe bus. Through this work, we pave the way for running microservices directly on FPGAs, bypassing CPU overhead and realising the full potential of FPGA acceleration in distributed cloud applications.",10.1145/3611312
10.1145/3617507,SensiX++: Bringing MLOps and Multi-tenant Model Serving to Sensory Edge Devices,"Min, Chulhong; Mathur, Akhil; Acer, Utku G\""{u}nay; Montanari, Alessandro; Kawsar, Fahim",2023,ACM Trans. Embed. Comput. Syst.,"We present SensiX++, a multi-tenant runtime for adaptive model execution with integrated MLOps on edge devices, e.g., a camera, a microphone, or IoT sensors. SensiX++ operates on two fundamental principles: highly modular componentisation to externalise data operations with clear abstractions and document-centric manifestation for system-wide orchestration. First, a data coordinator manages the lifecycle of sensors and serves models with correct data through automated transformations. Next, a resource-aware model server executes multiple models in isolation through model abstraction, pipeline automation, and feature sharing. An adaptive scheduler then orchestrates the best-effort executions of multiple models across heterogeneous accelerators, balancing latency and throughput. Finally, microservices with REST APIs serve synthesised model predictions, system statistics, and continuous deployment. Collectively, these components enable SensiX++ to serve multiple models efficiently with fine-grained control on edge devices while minimising data operation redundancy, managing data and device heterogeneity, and reducing resource contention. We benchmark SensiX++ with 10 different vision and acoustics models across various multi-tenant configurations on different edge accelerators (Jetson AGX and Coral TPU) designed for sensory devices. We report on the overall throughput and quantified benefits of various automation components of SensiX++ and demonstrate its efficacy in significantly reducing operational complexity and lowering the effort to deploy, upgrade, reconfigure, and serve embedded models on edge devices.",10.1145/3617507
10.1145/3622787,MicroProf: Code-level Attribution of Unnecessary Data Transfer in Microservice Applications,"Tariq, Syed Salauddin Mohammad; Menard, Lance; Su, Pengfei; Roy, Probir",2023,ACM Trans. Archit. Code Optim.,"The microservice architecture style has gained popularity due to its ability to fault isolation, ease of scaling applications, and developer’s agility. However, writing applications in the microservice design style has its challenges. Due to the loosely coupled nature, services communicate with others through standard communication APIs. This incurs significant overhead in the application due to communication protocol and data transformation. An inefficient service communication at the microservice application logic can further overwhelm the application. We perform a grey literature review showing that unnecessary data transfer is a real challenge in the industry. To the best of our knowledge, no effective tool is currently available to accurately identify the origins of unnecessary microservice communications that lead to significant performance overhead and provide guidance for optimization.To bridge the knowledge gap, we propose MicroProf, a dynamic program analysis tool to detect unnecessary data transfer in Java-based microservice applications. At the implementation level, MicroProf proposes novel techniques such as remote object sampling and hardware debug registers to monitor remote object usage. MicroProf reports the unnecessary data transfer at the application source code level. Furthermore, MicroProf pinpoints the opportunities for communication API optimization. MicroProf is evaluated on four well-known applications involving two real-world applications and two benchmarks, identifying five inefficient remote invocations. Guided by MicroProf, API optimization achieves an 87.5\% reduction in the number of fields within REST API responses. The empirical evaluation further reveals that the optimized services experience a speedup of up to 4.59\texttimes{}.",10.1145/3622787
10.1145/3630006,Component-distinguishable Co-location and Resource Reclamation for High-throughput Computing,"Zhao, Laiping; Cui, Yushuai; Yang, Yanan; Zhou, Xiaobo; Qiu, Tie; Li, Keqiu; Bao, Yungang",2024,ACM Trans. Comput. Syst.,"Cloud service providers improve resource utilization by co-locating latency-critical (LC) workloads with best-effort batch (BE) jobs in datacenters. However, they usually treat multi-component LCs as monolithic applications and treat BEs as “second-class citizens” when allocating resources to them. Neglecting the inconsistent interference tolerance abilities of LC components and the inconsistent preemption loss of BE workloads can result in missed co-location opportunities for higher throughput.We present Rhythm, a co-location controller that deploys workloads and reclaims resources rhythmically for maximizing the system throughput while guaranteeing LC service’s tail latency requirement. The key idea is to differentiate the BE throughput launched with each LC component, that is, components with higher interference tolerance can be deployed together with more BE jobs. It also assigns different reclamation priority values to BEs by evaluating their preemption losses into a multi-level reclamation queue. We implement and evaluate Rhythm using workloads in the form of containerized processes and microservices. Experimental results show that it can improve the system throughput by 47.3\%, CPU utilization by 38.6\%, and memory bandwidth utilization by 45.4\% while guaranteeing the tail latency requirement.",10.1145/3630006
10.1145/3631607,Optimizing Resource Management for Shared Microservices: A Scalable System Design,"Luo, Shutian; Lin, Chenyu; Ye, Kejiang; Xu, Guoyao; Zhang, Liping; Yang, Guodong; Xu, Huanle; Xu, Chengzhong",2024,ACM Trans. Comput. Syst.,"A common approach to improving resource utilization in data centers is to adaptively provision resources based on the actual workload. One fundamental challenge of doing this in microservice management frameworks, however, is that different components of a service can exhibit significant differences in their impact on end-to-end performance. To make resource management more challenging, a single microservice can be shared by multiple online services that have diverse workload patterns and SLA requirements.We present an efficient resource management system, namely Erms, for guaranteeing SLAs with high probability in shared microservice environments. Erms profiles microservice latency as a piece-wise linear function of the workload, resource usage, and interference. Based on this profiling, Erms builds resource scaling models to optimally determine latency targets for microservices with complex dependencies. Erms also designs new scheduling policies at shared microservices to further enhance resource efficiency. Experiments across microservice benchmarks as well as trace-driven simulations demonstrate that Erms can reduce SLA violation probability by 5\texttimes{} and more importantly, lead to a reduction in resource usage by 1.6\texttimes{}, compared to state-of-the-art approaches.",10.1145/3631607
10.1145/3665223,"IMAGE: An Open-Source, Extensible Framework for Deploying Accessible Audio and Haptic Renderings of Web Graphics","Regimbal, Juliette; Blum, Jeffrey R.; Kuo, Cyan; Cooperstock, Jeremy R.",2024,ACM Trans. Access. Comput.,"For accessibility practitioners, creating and deploying novel multimedia interactions for people with disabilities is a nontrivial task. As a result, many projects aiming to support such accessibility needs come and go or never make it to a public release. To reduce the overhead involved in deploying and maintaining a system that transforms web content into multimodal renderings, we created an open source, modular microservices architecture as part of the IMAGE project. This project aims to design richer means of interacting with web graphics than is afforded by a screen reader and text descriptions alone. To benefit the community of accessibility software developers, we discuss this architecture and explain how it provides support for several multimodal processing pipelines. Beyond illustrating the initial use case that motivated this effort, we further describe two use cases outside the scope of our project to explain how a team could use the architecture to develop and deploy accessible solutions for their own work. We then discuss our team’s experience working with the IMAGE architecture, informed by discussions with six project members, and provide recommendations to other practitioners considering applying the framework to their own accessibility projects.",10.1145/3665223
10.1145/3674726,HeMiRCA: Fine-Grained Root Cause Analysis for Microservices with Heterogeneous Data Sources,"Zhu, Zhouruixing; Lee, Cheryl; Tang, Xiaoying; He, Pinjia",2024,ACM Trans. Softw. Eng. Methodol.,"Microservices architecture improves software scalability, resilience, and agility but also poses significant challenges to system reliability due to their complexity and dynamic nature. Identifying and resolving anomalies promptly is crucial because they can quickly propagate to other microservices and cause severe damage to the system. Existing root-cause metric localization approaches rely on metrics or metrics-anomalies correlations but overlook other monitoring data sources (e.g., traces). We are the first to identify and leverage the anomaly-aware monotonic correlation between heterogeneous monitoring data, motivated by which we propose a novel framework, Heterogeneous data sources in Microservice systems for Root Cause Analysis (HeMiRCA), for hierarchical root cause analysis using Spearman correlation. HeMiRCA is based on the key observation that the microservice responsible for a particular type of fault exhibits a monotonic correlation between the trends of its associated metrics and the trace-based anomaly score of the system. HeMiRCA first calculates time-series anomaly scores using traces and then exploits the correlations between multivariate metrics and the scores to rank the suspicious metrics and microservices. HeMiRCA has been evaluated on two datasets collected from widely used microservice systems. The results show that HeMiRCA outperforms the state-of-the-art approaches by a large margin in identifying root causes at both service level and metric level, achieving a top-1 hit ratio of 82.7\% and 74\% on average, respectively.",10.1145/3674726
10.1145/3674734,Agile C-states: A Core C-state Architecture for Latency Critical Applications Optimizing both Transition and Cold-Start Latency,"Antoniou, Georgia; Bartolini, Davide; Volos, Haris; Kleanthous, Marios; Wang, Zhe; Kalaitzidis, Kleovoulos; Rollet, Tom; Li, Ziwei; Mutlu, Onur; Sazeides, Yiannakis; Haj Yahya, Jawad",2024,ACM Trans. Archit. Code Optim.,"Latency-critical applications running in modern datacenters exhibit irregular request arrival patterns and are implemented using multiple services with strict latency requirements (30–250μs). These characteristics render existing energy-saving idle CPU sleep states ineffective due to the performance overhead caused by the state’s transition latency. Besides the state transition latency, another important contributor to the performance overhead of sleep states is the cold-start latency, or in other words, the time required to warm up the microarchitectural state (e.g., cache contents, branch predictor metadata) that is flushed or discarded when transitioning to a lower-power state. Both the transition latency and cold-start latency can be particularly detrimental to the performance of latency critical applications with short execution times. While prior work focuses on mitigating the effects of transition and cold-start latency by optimizing request scheduling, in this work we propose a redesign of the core C-state architecture for latency-critical applications. In particular, we introduce C6Awarm, a new Agile core C-state that drastically reduces the performance overhead caused by idle sleep state transition latency and cold-start latency while maintaining significant energy savings. C6Awarm achieves its goals by (1) implementing medium-grained power gating, (2) preserving the microarchitectural state of the core, and (3) keeping the clock generator and PLL active and locked. Our analysis for a set of microservices based on an Intel Skylake server shows that C6Awarm manages to reduce the energy consumption by up to 70\% with limited performance degradation (at most 2\%).",10.1145/3674734
10.1145/3676167,Dynamically Balancing Load with Overload Control for Microservices,"Bhattacharya, Ratnadeep; Gao, Yuan; Wood, Timothy",2024,ACM Trans. Auton. Adapt. Syst.,"The microservices architecture simplifies application development by breaking monolithic applications into manageable microservices. However, this distributed microservice “service mesh” leads to new challenges due to the more complex application topology. Particularly, each service component scales up and down independently creating load imbalance problems on shared backend services accessed by multiple components. Traditional load balancing algorithms do not port over well to a distributed microservice architecture where load balancers are deployed client-side. In this article, we propose a self-managing load balancing system, BLOC, which provides consistent response times to users without using a centralized metadata store or explicit messaging between nodes. BLOC uses overload control approaches to provide feedback to the load balancers. We show that this performs significantly better in solving the incast problem in microservice architectures. A critical component of BLOC is the dynamic capacity estimation algorithm. We show that a well-tuned capacity estimate can outperform even join-the-shortest-queue, a nearly optimal algorithm, while a reasonable dynamic estimate still outperforms Least Connection, a distributed implementation of join-the-shortest-queue. Evaluating this framework, we found that BLOC improves the response time distribution range, between the 10th and 90th percentiles, by 2 –4 times and the tail, 99th percentile, latency by 2 times.",10.1145/3676167
10.1145/3687265,Performance Modeling of Distributed Data Processing in Microservice Applications,"Gao, Yicheng; Casale, Giuliano; Singhal, Rekha",2024,ACM Trans. Model. Perform. Eval. Comput. Syst.,"Microservice applications are increasingly adopted in distributed data processing systems, such as in mobile edge computing and data mesh architectures. However, existing performance models of such systems fall short in providing comprehensive insights into the intricate interplay between data placement and data processing. To address these issues, this article proposes a novel class of performance models that enables joint analysis of data storage access workflows, caching, and queueing contention. Our proposed models introduce a notion of access path for data items to model hierarchical data locality constraints. We develop analytical solutions to efficiently approximate the performance metrics of these models under different data caching policies, finding in particular conditions under which the underlying Markov chain admits a product-form solution. Extensive trace-driven simulations based on real-world datasets indicate that service and data placement policies based on our proposed models can respectively improve by up to 35\% and 37\% the average response time in edge and data mesh case studies.",10.1145/3687265
