key,title,authors,year,journal,abstract,doi
10.1145/3687301,Data Mesh: A Systematic Gray Literature Review,"Goedegebuure, Abel; Kumara, Indika; Driessen, Stefan; Van Den Heuvel, Willem-Jan; Monsieur, Geert; Tamburri, Damian Andrew; Nucci, Dario Di",2024,ACM Comput. Surv.,"Data mesh is an emerging domain-driven decentralized data architecture that aims to minimize or avoid operational bottlenecks associated with centralized, monolithic data architectures in enterprises. The topic has piqued the practitioners’ interest, and considerable gray literature exists. At the same time, we observe a lack of academic attempts at defining and building upon the concept. Hence, in this article, we aim to start from the foundations and characterize the data mesh architecture regarding its design principles, architectural components, capabilities, and organizational roles. We systematically collected, analyzed, and synthesized 114 industrial gray literature articles. The resulting review provides insights into practitioners’ perspectives on the four key principles of data mesh: data as a product, domain ownership of data, self-serve data platform, and federated computational governance. Moreover, due to the comparability of data mesh and SOA (service-oriented architecture), we mapped the findings from the gray literature into the reference architectures from the SOA academic literature to create the reference architectures for describing three key dimensions of data mesh: organization of capabilities and roles, development, and runtime. Finally, we discuss open research issues in data mesh, partially based on the findings from the gray literature.",10.1145/3687301
10.1145/3691630,On the Understandability of Design-Level Security Practices in Infrastructure-as-Code Scripts and Deployment Architectures,"Ntentos, Evangelos; Lueger, Nicole Elisabeth; Simhandl, Georg; Zdun, Uwe; Schneider, Simon; Scandariato, Riccardo; Ferreyra, Nicol\'{a}s E. D\'{\i}az",2024,ACM Trans. Softw. Eng. Methodol.,"Infrastructure as Code (IaC) automates IT infrastructure deployment, which is particularly beneficial for continuous releases, for instance, in the context of microservices and cloud systems. Despite its flexibility in application architecture, neglecting security can lead to vulnerabilities. The lack of comprehensive architectural security guidelines for IaC poses challenges in adhering to best practices. We studied how developers interpret IaC scripts (source code) in two IaC technologies, Ansible and Terraform, compared to semi-formal IaC deployment architecture models and metrics regarding design-level security understanding. In a controlled experiment involving ninety-four participants, we assessed the understandability of IaC-based deployment architectures through source code inspection compared to semi-formal representations in models and metrics.We hypothesized that providing semi-formal IaC deployment architecture models and metrics as supplementary material would significantly improve the comprehension of IaC security-related practices, as measured by task correctness. Our findings suggest that semi-formal IaC deployment architecture models and metrics as supplementary material enhance the understandability of IaC security-related practices without significantly increasing duration. We also observed a significant correlation between task correctness and duration when models and metrics were provided.",10.1145/3691630
10.1145/3700436,The Tale of Errors in Microservices,"Lee, I-Ting Angelina; Zhang, Zhizhou; Parwal, Abhishek; Chabbi, Milind",2024,Proc. ACM Meas. Anal. Comput. Syst.,"Microservice architecture is the computing paradigm of choice for large, service-oriented software catering to real-time requests. Individual programs in such a system perform Remote Procedure Calls (RPCs) to other microservices to accomplish sub-tasks. Microservices are designed to be robust; top-level requests can succeed despite errors returned from RPC sub-tasks, referred to as non-fatal errors. Because of this design, the top-level microservices tend to ''live with'' non-fatal errors. Hence, a natural question to ask is ''how prevalent are non-fatal errors and what impact do they have on the exposed latency of top-level requests?''In this paper, we present a large-scale study of errors in microservices. We answer the aforementioned question by analyzing 11 Billion RPCs covering 1,900 user-facing endpoints at the Uber serving requests of hundreds of millions of active users. To assess the latency impact of non-fatal errors, we develop a methodology that projects potential latency savings for a given request as if the time spent on failing APIs were eliminated. This estimator allows ranking and bubbling up those APIs that are worthy of further investigations, where the non-fatal errors likely resulted in operational inefficiencies. Finally, we employ our error detection and impact estimation techniques to pinpoint operational inefficiencies, which a) result in a tail latency reduction of a critical endpoint by 30\% and b) offer insights into common inefficiency-introducing patterns.",10.1145/3700436
10.1145/3702978,Identifying Performance Issues in Cloud Service Systems Based on Relational-Temporal Features,"Gu, Wenwei; Liu, Jinyang; Chen, Zhuangbin; Zhang, Jianping; Su, Yuxin; Gu, Jiazhen; Feng, Cong; Yang, Zengyin; Yang, Yongqiang; Lyu, Michael R.",2024,ACM Trans. Softw. Eng. Methodol.,"Cloud systems, typically comprised of various components (e.g., microservices), are susceptible to performance issues, which may cause service-level agreement violations and financial losses. Identifying performance issues is thus of paramount importance for cloud vendors. In current practice, crucial metrics, i.e., key performance indicators (KPIs), are monitored periodically to provide insight into the operational status of components. Identifying performance issues is often formulated as an anomaly detection problem, which is tackled by analyzing each metric independently. However, this approach overlooks the complex dependencies existing among cloud components. Some graph neural network-based methods take both temporal and relational information into account, however, the correlation violations in the metrics that serve as indicators of underlying performance issues are difficult for them to identify. Furthermore, a large volume of components in a cloud system results in a vast array of noisy metrics. This complexity renders it impractical for engineers to fully comprehend the correlations, making it challenging to identify performance issues accurately. To address these limitations, we propose Identifying Performance Issues based on Relational-Temporal Features (ISOLATE ), a learning-based approach that leverages both the relational and temporal features of metrics to identify performance issues. In particular, it adopts a graph neural network with attention to characterizing the relations among metrics and extracts long-term and multi-scale temporal patterns using a GRU and a convolution network, respectively. The learned graph attention weights can be further used to localize the correlation-violated metrics. Moreover, to relieve the impact of noisy data, ISOLATE utilizes a positive unlabeled learning strategy that tags pseudo labels based on a small portion of confirmed negative examples. Extensive evaluation on both public and industrial datasets shows that ISOLATE outperforms all baseline models with 0.945 F1-score and 0.920 Hit rate@3. The ablation study also proves the effectiveness of the relational-temporal features and the PU-learning strategy. Furthermore, we share the success stories of leveraging ISOLATE to identify performance issues in Huawei Cloud, which demonstrates its superiority in practice.",10.1145/3702978
10.14778/3476311.3476360,Query-driven video event processing for the internet of multimedia things,"Yadav, Piyush; Salwala, Dhaval; Pontes, Felipe Arruda; Dhingra, Praneet; Curry, Edward",2021,Proc. VLDB Endow.,"Advances in Deep Neural Network (DNN) techniques have revolutionized video analytics and unlocked the potential for querying and mining video event patterns. This paper details GNOSIS, an event processing platform to perform near-real-time video event detection in a distributed setting. GNOSIS follows a serverless approach where its component acts as independent microservices and can be deployed at multiple nodes. GNOSIS uses a declarative query-driven approach where users can write customize queries for spatiotemporal video event reasoning. The system converts the incoming video streams into a continuous evolving graph stream using machine learning (ML) and DNN models pipeline and applies graph matching for video event pattern detection. GNOSIS can perform both stateful and stateless video event matching. To improve Quality of Service (QoS), recent work in GNOSIS incorporates optimization techniques like adaptive scheduling, energy efficiency, and content-driven windows. This paper demonstrates the Occupational Health and Safety query use cases to show the GNOSIS efficacy.",10.14778/3476311.3476360
10.5555/3381555.3381567,Design and development of an open private educational cloud storage solution for application development,"Pyatt, Kevin; Lotfy, Mohamed",2019,J. Comput. Sci. Coll.,"CS, IT, and software engineering students need to learn and master web application development and cloud computing skills on an educational full-stack Cloud architecture. In this paper we provide the design of an educational full-stack architecture integrating a private storage cloud. The focus was on how to integrate, configure, secure and deploy web-software applications, microservices and private storage within a full-stack architecture. In this research study we determined the feasibility of designing and developing an open private-cloud storage solution for cloud software. We also share the results of the deployment and testing of phases 0 and 1 of the educational full-stack architecture.",
10.5555/3575846.3575851,The structure and delivery of an advanced systems administration IT course,"Lotfy, Mohamed; Fredrickson, Christian",2022,J. Comput. Sci. Coll.,"IT program courses should allow students to acquire the needed IT skills to enable them to be job ready by graduation. To prepare the IT graduates to current and future practices of virtualized computing resources, which integrate IT systems and services, DevOps and microservices, systems administration courses need to introduce students to current tools used to administer and manage continuous integration and deployment of infrastructure and services. In this paper, we provide the structure, components, hands-on assignments, and the virtual environment of a senior-level competency-based advanced Unix/Linux systems administration course that is delivered face-to-face and online. The course introduces current organizational practices of continuous integration and delivery of services. Student course evaluation and what helped them learn the most are also presented and discussed.",
