key,title,authors,year,journal,abstract,doi
10.1109/TNET.2020.2973800,Vehicular-OBUs-As-On-Demand-Fogs: Resource and Context Aware Deployment of Containerized Micro-Services,"Sami, Hani; Mourad, Azzam; El-Hajj, Wassim",2020,IEEE/ACM Trans. Netw.,"Observing the headway in vehicular industry, new applications are developed demanding more resources. For instance, real-time vehicular applications require fast processing of the vast amount of generated data by vehicles in order to maintain service availability and reachability while driving. Fog devices are capable of bringing cloud intelligence near the edge, making them a suitable candidate to process vehicular requests. However, their location, processing power, and technology used to host and update services affect their availability and performance while considering the mobility patterns of vehicles. In this paper, we overcome the aforementioned limitations by taking advantage of the evolvement of On-Board Units, Kubeadm Clustering, Docker Containerization, and micro-services technologies. In this context, we propose an efficient resource and context aware approach for deploying containerized micro-services on on-demand fogs called Vehicular-OBUs-As-On-Demand-Fogs. Our proposed scheme embeds (1) a Kubeadm based approach for clustering OBUs and enabling on-demand micro-services deployment with the least costs and time using Docker containerization technology, (2) a hybrid multi-layered networking architecture to maintain reachability between the requesting user and available vehicular fog cluster, and (3) a vehicular multi-objective container placement model for producing efficient vehicles selection and services distribution. An Evolutionary Memetic Algorithm is elaborated to solve our vehicular container placement problem. Experiments and simulations demonstrate the relevance and efficiency of our approach compared to other recent techniques in the literature.",10.1109/TNET.2020.2973800
10.1109/TNET.2024.3366561,"SPRIGHT: High-Performance eBPF-Based Event-Driven, Shared-Memory Processing for Serverless Computing","Qi, Shixiong; Monis, Leslie; Zeng, Ziteng; Wang, Ian-Chin; Ramakrishnan, K. K.",2024,IEEE/ACM Trans. Netw.,"Serverless computing promises an efficient, low-cost compute capability in cloud environments. However, existing solutions, epitomized by open-source platforms such as Knative, include heavyweight components that undermine this goal of serverless computing. Additionally, such serverless platforms lack dataplane optimizations to achieve efficient, high-performance function chains that facilitate the popular microservices development paradigm. Their use of unnecessarily complex and duplicate capabilities for building function chains severely degrades performance. ‘Cold-start’ latency is another deterrent. We describe SPRIGHT, a lightweight, high-performance, responsive serverless framework. SPRIGHT exploits shared memory processing and dramatically improves the scalability of the dataplane by avoiding unnecessary protocol processing and serialization-deserialization overheads. SPRIGHT extensively leverages event-driven processing with the extended Berkeley Packet Filter (eBPF). We creatively use eBPF’s socket message mechanism to support shared memory processing, with overheads being strictly load-proportional. Compared to constantly-running, polling-based DPDK, SPRIGHT achieves the same dataplane performance with &lt;inline-formula&gt; &lt;tex-math notation=""LaTeX""&gt;$10times $ &lt;/tex-math&gt;&lt;/inline-formula&gt; less CPU usage under realistic workloads. Additionally, eBPF benefits SPRIGHT, by replacing heavyweight serverless components, allowing us to keep functions ‘warm’ with negligible penalty. Our preliminary experimental results show that SPRIGHT achieves an order of magnitude improvement in throughput and latency compared to Knative, while substantially reducing CPU usage, and obviates the need for ‘cold-start’.",10.1109/TNET.2024.3366561
10.1109/TNET.2024.3394514,Zero+: Monitoring Large-Scale Cloud-Native Infrastructure Using One-Sided RDMA,"Song, Zhuo; Wu, Jiejian; Ma, Teng; Wang, Zhe; Kong, Linghe; Wen, Zhenzao; Li, Jingxuan; Lu, Yang; Yang, Yong; Ma, Tao; Liu, Zheng; Chen, Guihai",2024,IEEE/ACM Trans. Netw.,"Cloud services have shifted from monolithic designs to microservices running on cloud-native infrastructure with monitoring systems to ensure service level agreements (SLAs). However, traditional monitoring systems no longer meet the demands of cloud-native monitoring. In Alibaba’s “double eleven” shopping festival, it is observed that the monitor occupies resources of the monitored infrastructure and even disrupts services. In this paper, we propose a novel monitoring system named Zero+ for cloud-native monitoring. Zero+ achieves zero overhead in collecting raw metrics using one-sided remote direct memory access (RDMA) and remedies network congestion by adopting a receiver-driven flow control scheme. Zero+ also features a priority queue mechanism to meet different quality of service requirements and an efficient batch processing design to relieve CPU occupation. Zero+ has been deployed and evaluated in four different clusters with heterogeneous RDMA NIC devices and architectures in Alibaba Cloud. Results show that Zero+ achieves no CPU occupation at the monitored host and supports &lt;inline-formula&gt; &lt;tex-math notation=""LaTeX""&gt;$1sim 10k$ &lt;/tex-math&gt;&lt;/inline-formula&gt; hosts with &lt;inline-formula&gt; &lt;tex-math notation=""LaTeX""&gt;$0.1sim 1s$ &lt;/tex-math&gt;&lt;/inline-formula&gt; sampling interval using a single thread for network I/O. Zero+ significantly relieves the incast issue and maintains &lt;inline-formula&gt; &lt;tex-math notation=""LaTeX""&gt;$80sim 95\%$ &lt;/tex-math&gt;&lt;/inline-formula&gt; of bandwidth utilization in several clusters when monitoring &lt;inline-formula&gt; &lt;tex-math notation=""LaTeX""&gt;$1k$ &lt;/tex-math&gt;&lt;/inline-formula&gt; hosts. Zero+ also ensures services with high priority accomplish collecting metrics earlier than low priority ones by at least &lt;inline-formula&gt; &lt;tex-math notation=""LaTeX""&gt;$400 mu s$ &lt;/tex-math&gt;&lt;/inline-formula&gt; when monitoring &lt;inline-formula&gt; &lt;tex-math notation=""LaTeX""&gt;$1k$ &lt;/tex-math&gt;&lt;/inline-formula&gt; hosts.",10.1109/TNET.2024.3394514
10.1109/TNET.2024.3400953,DeepScaling: Autoscaling Microservices With Stable CPU Utilization for Large Scale Production Cloud Systems,"Wang, Ziliang; Zhu, Shiyi; Li, Jianguo; Jiang, Wei; Ramakrishnan, K. K.; Yan, Meng; Zhang, Xiaohong; Liu, Alex X.",2024,IEEE/ACM Trans. Netw.,"Cloud service providers often provision excessive resources to meet the desired Service Level Objectives (SLOs), by setting lower CPU utilization targets. This can result in a waste of resources and a noticeable increase in power consumption in large-scale cloud deployments. To address this issue, this paper presents DeepScaling, an innovative solution for minimizing resource cost while ensuring SLO requirements are met in a dynamic, large-scale production microservice-based system. We propose DeepScaling, which introduces three innovative components to adaptively refine the target CPU utilization of servers in the data center, and we maintain it at a stable value to meet SLO constraints while using minimum amount of system resources. First, DeepScaling forecasts workloads for each service using a Spatio-temporal Graph Neural Network. Secondly, it estimates CPU utilization with a Deep Neural Network, considering factors such as periodic tasks and traffic. Finally, it uses a modified Deep Q-Network (DQN) to generate an autoscaling policy that controls service resources to maximize service stability while meeting SLOs. Evaluation of DeepScaling in Ant Group’s large-scale cloud environment shows that it outperforms state-of-the-art autoscaling approaches in terms of maintaining stable performance and resource savings. The deployment of DeepScaling in the real-world environment of 1900+ microservices saves the provisioning of over 100,000 CPU cores per day, on average.",10.1109/TNET.2024.3400953
10.1145/3104028,Architectural Principles for Cloud Software,"Pahl, Claus; Jamshidi, Pooyan; Zimmermann, Olaf",2018,ACM Trans. Internet Technol.,"A cloud is a distributed Internet-based software system providing resources as tiered services. Through service-orientation and virtualization for resource provisioning, cloud applications can be deployed and managed dynamically. We discuss the building blocks of an architectural style for cloud-based software systems. We capture style-defining architectural principles and patterns for control-theoretic, model-based architectures for cloud software. While service orientation is agreed on in the form of service-oriented architecture and microservices, challenges resulting from multi-tiered, distributed and heterogeneous cloud architectures cause uncertainty that has not been sufficiently addressed. We define principles and patterns needed for effective development and operation of adaptive cloud-native systems.",10.1145/3104028
10.1145/3226644,A Unified Model for the Mobile-Edge-Cloud Continuum,"Baresi, L.; Mendon\c{c}a, D. F.; Garriga, M.; Guinea, S.; Quattrocchi, G.",2019,ACM Trans. Internet Technol.,"Technologies such as mobile, edge, and cloud computing have the potential to form a computing continuum for new, disruptive applications. At runtime, applications can choose to execute parts of their logic on different infrastructures that constitute the continuum, with the goal of minimizing latency and battery consumption and maximizing availability. In this article, we propose A3-E, a unified model for managing the life cycle of continuum applications. In particular, A3-E exploits the Functions-as-a-Service model to bring computation to the continuum in the form of microservices. Furthermore, A3-E selects where to execute a certain function based on the specific context and user requirements. The article also presents a prototype framework that implements the concepts behind A3-E. Results show that A3-E is capable of dynamically deploying microservices and routing the application’s requests, reducing latency by up to 90\% when using edge instead of cloud resources, and battery consumption by 74\% when computation has been offloaded.",10.1145/3226644
10.1145/3293455,RESTful API Automated Test Case Generation with EvoMaster,"Arcuri, Andrea",2019,ACM Trans. Softw. Eng. Methodol.,"RESTful APIs are widespread in industry, especially in enterprise applications developed with a microservice architecture. A RESTful web service will provide data via an API over the network using HTTP, possibly interacting with databases and other web services. Testing a RESTful API poses challenges, because inputs/outputs are sequences of HTTP requests/responses to a remote server. Many approaches in the literature do black-box testing, because often the tested API is a remote service whose code is not available. In this article, we consider testing from the point of view of the developers, who have full access to the code that they are writing. Therefore, we propose a fully automated white-box testing approach, where test cases are automatically generated using an evolutionary algorithm. Tests are rewarded based on code coverage and fault-finding metrics. However, REST is not a protocol but rather a set of guidelines on how to design resources accessed over HTTP endpoints. For example, there are guidelines on how related resources should be structured with hierarchical URIs and how the different HTTP verbs should be used to represent well-defined actions on those resources. Test-case generation for RESTful APIs that only rely on white-box information of the source code might not be able to identify how to create prerequisite resources needed before being able to test some of the REST endpoints. Smart sampling techniques that exploit the knowledge of best practices in RESTful API design are needed to generate tests with predefined structures to speed up the search. We implemented our technique in a tool called EvoMaster, which is open source. Experiments on five open-source, yet non-trivial, RESTful services show that our novel technique automatically found 80 real bugs in those applications. However, obtained code coverage is lower than the one achieved by the manually written test suites already existing in those services. Research directions on how to further improve such an approach are therefore discussed, such as the handling of SQL databases.",10.1145/3293455
10.1145/3381452,Cloud Deployment Tradeoffs for the Analysis of Spatially Distributed Internet of Things Systems,"Tsigkanos, Christos; Garriga, Martin; Baresi, Luciano; Ghezzi, Carlo",2020,ACM Trans. Internet Technol.,"Internet-enabled devices operating in the physical world are increasingly integrated in modern distributed systems. We focus on systems where the dynamics of spatial distribution is crucial; in such cases, devices may need to carry out complex computations (e.g., analyses) to check satisfaction of spatial requirements. The requirements are partly global—as the overall system should achieve certain goals—and partly individual, as each entity may have different goals. Assurance may be achieved by keeping a model of the system at runtime, monitoring events that lead to changes in the spatial environment, and performing requirements analysis. However, computationally intensive runtime spatial analysis cannot be supported by resource-constrained devices and may be offloaded to the cloud. In such a scenario, multiple challenges arise regarding resource allocation, cost, performance, among other dimensions. In particular, when the workload is unknown at the system’s design time, it may be difficult to guarantee application-service-level agreements, e.g., on response times. To address and reason on these challenges, we first instantiate complex computations as microservices and integrate them to an IoT-cloud architecture. Then, we propose alternative cloud deployments for such an architecture—based on virtual machines, containers, and the recent Functions-as-a-Service paradigm. Finally, we assess the feasibility and tradeoffs of the different deployments in terms of scalability, performance, cost, resource utilization, and more. We adopt a workload scenario from a known dataset of taxis roaming in Beijing, and we derive other workloads to represent unexpected request peaks and troughs. The approach may be replicated in the design process of similar classes of spatially distributed IoT systems.",10.1145/3381452
10.1145/3418899,A Black-box Monitoring Approach to Measure Microservices Runtime Performance,"Brondolin, Rolando; Santambrogio, Marco D.",2020,ACM Trans. Archit. Code Optim.,"Microservices changed cloud computing by moving the applications’ complexity from one monolithic executable to thousands of network interactions between small components. Given the increasing deployment sizes, the architectural exploitation challenges, and the impact on data-centers’ power consumption, we need to efficiently track this complexity. Within this article, we propose a black-box monitoring approach to track microservices at scale, focusing on architectural metrics, power consumption, application performance, and network performance. The proposed approach is transparent w.r.t. the monitored applications, generates less overhead w.r.t. black-box approaches available in the state-of-the-art, and provides fine-grain accurate metrics.",10.1145/3418899
10.1145/3466696,Autonomic Security Management for IoT Smart Spaces,"Lin, Changyuan; Khazaei, Hamzeh; Walenstein, Andrew; Malton, Andrew",2021,ACM Trans. Internet Things,"Embedded sensors and smart devices have turned the environments around us into smart spaces that could automatically evolve, depending on the needs of users, and adapt to the new conditions. While smart spaces are beneficial and desired in many aspects, they could be compromised and expose privacy, security, or render the whole environment a hostile space in which regular tasks cannot be accomplished anymore. In fact, ensuring the security of smart spaces is a very challenging task due to the heterogeneity of devices, vast attack surface, and device resource limitations. The key objective of this study is to minimize the manual work in enforcing the security of smart spaces by leveraging the autonomic computing paradigm in the management of IoT environments. More specifically, we strive to build an autonomic manager that can monitor the smart space continuously, analyze the context, plan and execute countermeasures to maintain the desired level of security, and reduce liability and risks of security breaches. We follow the microservice architecture pattern and propose a generic ontology named Secure Smart Space Ontology (SSSO) for describing dynamic contextual information in security-enhanced smart spaces. Based on SSSO, we build an autonomic security manager with four layers that continuously monitors the managed spaces, analyzes contextual information and events, and automatically plans and implements adaptive security policies.As the evaluation, focusing on a current BlackBerry customer problem, we deployed the proposed autonomic security manager to maintain the security of a smart conference room with 32 devices and 66 services. The high performance of the proposed solution was also evaluated on a large-scale deployment with over 1.8 million triples.",10.1145/3466696
10.1145/3470658,Adaptive Management of Volatile Edge Systems at Runtime With Satisfiability,"Avasalcai, Cosmin; Tsigkanos, Christos; Dustdar, Schahram",2021,ACM Trans. Internet Technol.,"Edge computing offers the possibility of deploying applications at the edge of the network. To take advantage of available devices’ distributed resources, applications often are structured as microservices, often having stringent requirements of low latency and high availability. However, a decentralized edge system that the application may be intended for is characterized by high volatility, due to devices making up the system being unreliable or leaving the network unexpectedly. This makes application deployment and assurance that it will continue to operate under volatility challenging. We propose an adaptive framework capable of deploying and efficiently maintaining a microservice-based application at runtime, by tackling two intertwined problems: (i) finding a microservice placement across device hosts and (ii) deriving invocation paths that serve it. Our objective is to maintain correct functionality by satisfying given requirements in terms of end-to-end latency and availability, in a volatile edge environment. We evaluate our solution quantitatively by considering performance and failure recovery.",10.1145/3470658
10.1145/3478680,"Service Computing for Industry 4.0: State of the Art, Challenges, and Research Opportunities","Siqueira, Frank; Davis, Joseph G.",2021,ACM Comput. Surv.,"Recent advances in the large-scale adoption of information and communication technologies in manufacturing processes, known as Industry 4.0 or Smart Manufacturing, provide us a window into how the manufacturing sector will evolve in the coming decades. As a result of these initiatives, manufacturing firms have started to integrate a series of emerging technologies into their processes that will change the way products are designed, manufactured, and consumed. This article provides a comprehensive review of how service-oriented computing is being employed to develop the required software infrastructure for Industry 4.0 and identifies the major challenges and research opportunities that ensue. Particular attention is paid to the microservices architecture, which is increasingly recognized as offering a promising approach for developing innovative industrial applications. This literature review is based on the current state of the art on service computing for Industry 4.0 as described in a large corpus of recently published research papers, which helped us to identify and explore a series of challenges and opportunities for the development of this emerging technology frontier, with the goal of facilitating its widespread adoption.",10.1145/3478680
10.1145/3502724,Dynamic Evaluation of Microservice Granularity Adaptation,"Hassan, Sara; Bahsoon, Rami; Minku, Leandro; Ali, Nour",2022,ACM Trans. Auton. Adapt. Syst.,"Microservices have gained acceptance in software industries as an emerging architectural style for autonomic, scalable, and more reliable computing. Among the critical microservice architecture design decisions is when to adapt the granularity of a microservice architecture by merging/decomposing microservices. No existing work investigates the following question: How can we reason about the trade-off between predicted benefits and cost of pursuing microservice granularity adaptation under uncertainty? To address this question, we provide a novel formulation of the decision problem to pursue granularity adaptation as a real options problem. We propose a novel evaluation process for dynamically evaluating granularity adaptation design decisions under uncertainty. Our process is based on a novel combination of real options and the concept of Bayesian surprises. We show the benefits of our evaluation process by comparing it to four representative industrial microservice runtime monitoring tools, which can be used for retrospective evaluation for granularity adaptation decisions. Our comparison shows that our process can supersede and/or complement these tools. We implement a microservice application—Filmflix—using Amazon Web Service Lambda and use this implementation as a case study to show the unique benefit of our process compared to traditional application of real options analysis.",10.1145/3502724
10.1145/3508360,The Serverless Computing Survey: A Technical Primer for Design Architecture,"Li, Zijun; Guo, Linsong; Cheng, Jiagan; Chen, Quan; He, Bingsheng; Guo, Minyi",2022,ACM Comput. Surv.,"The development of cloud infrastructures inspires the emergence of cloud-native computing. As the most promising architecture for deploying microservices, serverless computing has recently attracted more and more attention in both industry and academia. Due to its inherent scalability and flexibility, serverless computing becomes attractive and more pervasive for ever-growing Internet services. Despite the momentum in the cloud-native community, the existing challenges and compromises still wait for more advanced research and solutions to further explore the potential of the serverless computing model. As a contribution to this knowledge, this article surveys and elaborates the research domains in the serverless context by decoupling the architecture into four stack layers: Virtualization, Encapsule, System Orchestration, and System Coordination. Inspired by the security model, we highlight the key implications and limitations of these works in each layer, and make suggestions for potential challenges to the field of future serverless computing.",10.1145/3508360
10.1145/3532183,"Microservice Security Metrics for Secure Communication, Identity Management, and Observability","Zdun, Uwe; Queval, Pierre-Jean; Simhandl, Georg; Scandariato, Riccardo; Chakravarty, Somik; Jelic, Marjan; Jovanovic, Aleksandar",2023,ACM Trans. Softw. Eng. Methodol.,"Microservice architectures are increasingly being used to develop application systems. Despite many guidelines and best practices being published, architecting microservice systems for security is challenging. Reasons are the size and complexity of microservice systems, their polyglot nature, and the demand for the continuous evolution of these systems. In this context, to manually validate that security architecture tactics are employed as intended throughout the system is a time-consuming and error-prone task. In this article, we present an approach to avoid such manual validation before each continuous evolution step in a microservice system, which we demonstrate using three widely used categories of security tactics: secure communication, identity management, and observability. Our approach is based on a review of existing security guidelines, the gray literature, and the scientific literature, from which we derived Architectural Design Decisions (ADDs) with the found security tactics as decision options. In our approach, we propose novel detectors to detect these decision options automatically and formally defined metrics to measure the conformance of a system to the different options of the ADDs. We apply the approach to a case study data set of 10 open source microservice systems, plus another 20 variants of these systems, for which we manually inspected the source code for security tactics. We demonstrate and assess the validity and appropriateness of our metrics by performing an assessment of their conformance to the ADDs in our systems’ dataset through statistical methods.",10.1145/3532183
